,title,description,title_label,description_label
733, 강원도 동해  여행   혼자  다녀온  박  일  여행 ,강원도 동해 여행 혼자 다녀온  박  일 여행  강원도여행  동해여행  강원도동해  혼자여행   동해  국내여행 명절 연휴를 맞아 오랜만에  혼자 여행 을 가보기로 했다  이렇게 긴 연휴가 생기면 무조건 비행기 표를  ,1,1
734, 부산 혼자여행   일차  바로해장  수변최고돼지국밥  ,부산여행  혼자부산여행  부산여행 박 일코스  부산여행 박 일  국내여자 혼자여행   여자 혼자여행   국내 혼자여행   국내여행  부산여자 혼자여행   부산뚜벅이여행  부산고등어봉초밥  부산사바보우즈시  부산호맥  ,1,1
735,여수 호텔  혼자 여행 에도 좋은 깔끔한 가성비 여수 숙소,여수 혼자여행 이거나 장기 여행일 때 아주 좋은 게 세탁기도 있고 싱크 딸린 주방이 있으니까요  대신 인덕션은 호텔에서는 사용 금지 대신 전자레인지랑 전기주전자 있어요  냉장고에는 생수  병 무료  ,1,1
736,제천 이치텐 제천 텐동 맛집 제천  혼자여행  혼밥,제천 이치텐 제천 텐동 맛집 제천  혼자여행  혼밥 소개 안녕하세요  어느덧 일주일의 반이 지나는 수요일입니다  점심 맛있게들 드셨는지  저는 별로 맛없는 점심을 먹어 맛있는 음식을 가져왔습니다  제천에  ,1,1
737,제주도  여행  여자  대  혼자  사려니숲길도 걷고 안전하게  ,제주도 여행  대 여자 혼자 사려니숲길도 걷고 안전하게 제주 여행도 하였네요 제주에 여성  혼자 여행 하는것이 쉽지는 않겠지요  하지만 이번에  뭐 꼭 이번만 아니더라도 제주도 여행  대 여자 혼자 하는  ,1,1
738, 혼자여행  춘천스테이  감성숙소  춘천호텔추천  플레인스테이  ,강원도 춘천 여행    춘천숙소추천   플레인스테이 봄이 찾아온   에서 모닝루틴을 시작합니다  아직은 수줍어서 저  혼자 만 ㅎㅎㅎ 더욱 기다려 지는 올해 봄  오늘 하루 였습니다              ,1,1
739, 혼자여행  통영  박 일 여행  일차   심가네 해물짬뽕   , 나 혼자여행   혼자여행   혼자통영  통영  통영여행  통영현지인맛집  섬투어후맛있는거  통영맛집  통영짬뽕  통영해물짬뽕  심가네해물짬뽕  친절한맛집  국내여행  찐후기  솔직후기  솔직담백한  ,1,1
740, 혼자 여행 도 좋은 스페인일주 반자유여행 유럽세미패키지  , 혼자여행 도 가기좋은  스페인일주  유럽세미패키지 요즘  혼자 여행 으로 스페인  반자유여행 많이 가시죠  떠나기 전의 설레임과 도착 후 즐거움이 가득한 스페인 유럽세미패키지를 소개합니다  스페인은  ,1,1
741,부여  혼자여행   ,혼자하는 첫번째 여행이 끝났다 생각보다 더 자유롭고 더 재밌다 다음  혼자여행 은 어디로 떠날까    부여여행  부여 혼자여행   부여 박 일  국내 혼자여행   부여버스  부여뚜벅이여행  부여가볼만한곳  ,1,1
742,시드니 여자 혼자여행  후기  시드니 최애 카페 스팟  시드니  ,오늘은 시드니 여자 혼자여행  후기와 시드니 여행중에 제가 느낀 최애 카페  최애 스팟   사진들 포스팅 해볼게요 시드니 여자 혼자여행  괜찮나요  완전  괜찮습니다  제가 호주 포함 미국  유럽  동남아 등  ,1,1
743,주말   혼자  바다 여행 ,관광버스로 여행 오는 단체 관광객도 많고 일반 여행객도 많아  혼자 여행 하기 부담스러울 때가 많다  예전 파트너와 함께였을 때는 먹는 일이 즐거웠는데  혼자서 여행할 때는 그 즐거운 일이 정말  일 이 될  ,1,1
744,  일본  혼자여행   교토  일차  교토 선거암  켄닌지 건인사  ,  이전글       교토여행  일차     선거암 켄닌지 건인사 호칸지 야사카의 탑  니넨자카 산넨자카  하고 번역 오류겠지 했는데 욕실 맞았읍니다 파파고 잘하네  혼자 여행 이라 내 사진 찍기가 좀 애매한데  ,0,1
745,제주  혼자 여행    제주 요가 원데이클래스 프립캠프 요가,작년  월에 제주  혼자 여행 을 떠나며 예약했던 요가 원데이 클래스를 소개해볼까 합니다    혼자 여행 을  혼자 제주여행 오신다면 아침에 조금 일찍 일어나 요가클래스 들어보는거 정말 강추드려요  혼자서  ,0,1
746,제주  혼자 여행  즐기는 방법  ,살면서 처음으로 비행기를 타보고 제주  혼자 여행 이라는 걸 다녀왔었어요 혼자 무슨 재미야  나는 좋은걸 같이 즐기면서 여행하는게 좋아라고 느꼈었는데 제주  혼자 여행 을 하면서 그 재미를   만끽하고 와서  ,1,1
747, 박 일 제주도  혼자여행  은희네 해장국   먹자씨 흑돼지  ,여름철에만 볼 수 있는 진풍경 인생사진을 건지고 싶다면 서우봉은 꼬옥 가시오 난  혼자여행 이었기에  아무튼 혼자 떠난 여행은 내면의 고독과 직접적으로 맞설 수 있는 소중한 시간이 되어주었다  외로움과  ,1,1
748,투리즈메 아비뉴         여자 혼자  유럽 여행 ,   파리여행  여자혼자유럽여행 파리 여행  박  일 동안 호텔  곳을 갔다  이비스 스타일 파리  그런데  혼자 여행  또는 친구와의 여행이라면 이비스 스타일 파리 에펠 캉브론 호텔이 가성비가 더  ,0,1
749,여자  혼자   박 일 일본 후쿠오카  여행   다자이후 덴만구  ,돌아다니니  혼자 여행 하기에는 아주 편리했던것 같아요   여자혼자일본여행  혼자일본 박 일  여자혼자후쿠오카여행  혼자후쿠오카여행  여자혼자해외여행  혼자해외여행  혼자해외 박 일  ,0,1
751,아리일기    박  일 강릉  혼자 여행   일차,이번에 강릉으로  혼자 여행 을 다녀왔다  여행 이라고 하기엔 좀 한 게 없지만 ㅎ 여행을 가게 된  이날 바닷가에 혼자 온 사람들이 꽤 많았다  그래서 혼자 앉아서 멍 때리는거나 혼자 사진 찍는게 하나도  ,1,1
752,강릉 혼자여행  찾아서 바다 보러간 강릉 강문해변,강릉 혼자여행  코스 중에서 제가 소개드릴 장소는 아름다운 바다가 해수욕장으로 이름난 강릉 강문해변입니다  강원도 여행에서 강릉을 찾는 이유는 이 아름다운 바다 때문이라는 생각이 들 정도로 멋진  ,1,1
753, 혼자 서 제주도  여행 ,내 나이   이 나이 먹도록  혼자 여행 도 안가봐서 알바 그만두는겸 제주도 여행을 왔습니다  일단 혼자 자유롭게 다니고싶은것도 있었지만  워홀 맛보기 마냥 혼자 지내는게 괜찮은가  난 혼자 잘 해내는가  ,1,1
754,싱가포르 유니버설 스튜디오 필수 어트랙션   여자  혼자 여행  ,지난  년  월  코로나 상황에 트래블버블 체결되고 얼마 지나지 않아 혼자 다녀온 싱가포르  박  일 여행  여자  혼자 여행  가는 것이었지만 일정에 내가 그간 꼭 가보고 싶었던 싱가포르 유니버설 스튜디오는  ,1,1
755, 혼자 여행 도 재미있음  , 혼자  다니는  여행  유튜브를 볼때면 가끔 낯선 사람들과 어울리는 장면이 나온다  여행 의 낭만과도 같은 일이 내게도 일어났다 행남해안산책로를 걷다가 만난 인연덕에 열가지 계획중 하나인 막걸리와 오징어를  ,1,1
756,제주도  혼자여행  다녀왔어요 , 프롤로그  나만 생각하자 떠난  혼자 여행 이었지만  좋은 곳에 가고  좋은 것을 볼때면 남편이랑 왔으면  혼자하는 여행이 좋기도 했지만  처음이라서 걱정을 많이했던 탓일까  아직 자유로운 마음을 온전히  ,1,1
757,퐁피두 센터 뮤지엄패스    파리 여행   일차  여자  혼자  유럽  여행 ,파리  퐁피두 센터  파리여행  여자혼자유럽여행 파리  혼자 여행   일차 일정   튈르리 정원   오랑주리 미술관   루브르박물관   퐁피두센터   개선문 전망대 야경 밤에 보는  ,1,1
758, 여자 혼자  제주도  박 일  여행   일차,싶었지만 혼자 하는 여행이라 ㅠ 이럴땐 조금 서럽  ㅠㅠ 차마 찍어달란 말도 못하고  나름 내성적인  여자  혼자 여행 할 경우 완전 추천  피자  원 피자 먹으면서  뷰티인사이드  관람  제주도 여행와서  ,1,1
759,아들  혼자 여행 일차,여행 하루 전 딸냄 코로나확진됨 딸은 여행 못 가서 울고 아들은 여행 혼자 가게 됐다며 울고 뭔가  이번달에 취업을 해서 사회생활까지 할 녀석이 아주 징징대며  혼자여행  어캐라며  무사히 도착하고 숙소도  ,1,1
761,퇴사 후  혼자 여행 하기  일차,이번  여행 의 목표는 해안선 따라 달리기이기 때문에ㅎㅎ 마지막으로 정동진 왔을 때가 수능 끝나고였나  다행히  가는 길 쓸쓸하지 않게 퇴사동지가 있다ㅋㅋ 입사할 땐  혼자 였지만 퇴사할 땐 둘이구나  ,1,1
762, 혼자  하는 뚜벅이 전주 여행 , 혼자 여행 이라 한복 사진을 찍을 수 없어서 아쉽게도 사진은 없지만 엄청 좋았습니다  겨울이라 춥지  혼자 하는 여행이라 말할 사람은 없어 조금 심심했지만  볼 것도 많고 일단 마을 자체의 분위기가 너무  ,1,1
763,여자  혼자 해외 여행  첫 해외 여행 지 추천 리스트,여자 혼자해외여행  초보여행 추천 리스트 첫 해외여행지 여자 혼자해외여행 갈만한곳  초보여행이나  해외여행지 추천 리스트  곳을 뽑아봤어요  이번에 여자들끼리 가족여행 다녀오면서 이런 곳은  혼자 여행  ,1,1
765,방콕  혼자 여행  떠난다면 지하철역 가까운 모드사톤 호텔 추천,방콕  혼자 여행  방콕  혼자 여행  계획하신다면 사실 거의 관광위주의 여행타입이 많은 것 같아요  혼자 자유롭게 돌아다니다가 쉬고싶을 때는 그냥 쉬고  먹고 싶은 거 먹고 하는 혼여의 묘미는 한 번 빠지면  ,1,1
766, 부산 바오하우스 갔다가 톤쇼우 대기없이 먹는  혼자여행 ,부산  여행  혹시 모르니 키트도 한번 해주고 추 추울발  나  정말 가는고니  서면  바오하우스   가지튀김 맛집   마파두부 맛집   혼밥 맛집 연중무휴        브레이크타임   일요일에  혼자  ,1,1
767,    나름 알찼던 나  혼자  부산 뚜벅이  여행 ,혼자 뚜벅뚜벅 다녀온 부산 여행 신기한건 혼자 다니니까 피곤한걸 못느꼈다 다리 아픈것도 힘든것도  ㅎ  혼자 여행 하면 주의할 점   음식에 욕심내지 말것 행복했다 그런데 항상 어딘가를 힐링하기 위해  ,1,1
768,경주  혼자여행   탄   경주의 야경 투어   첨성대  ,근데 여기는 직접 가보면 다들 얼마나 예쁜지 알 것이당 너무 예뻐서 다음날 또 옴 혼자 이 길을 따라   탄     경주  경주여행  경주여행지  첨성대  경주여행지추천  국내여행  혼자여행   여행  여행지  ,1,1
769,국내여행 추천 제주도  혼자 여행  제주 시내 가볼만한곳  ,대신 혼자 국내여행 중에 김만덕 기념관 내부는 천천히 둘러보며 전시 작품들을 봤답니다 제주  혼자 여행  하면서 옛 제주의 생활에 대해서 볼 수 있는 장소가 되기도 하고 제주도 대표 명소 동문시장 같은 곳도  ,1,1
770,전망대 야경 뮤지엄패스    파리 여행   일차  여자  혼자  유럽  여행 ,파리  에투알 개선문 전망대 야경  파리여행  여자혼자유럽여행 파리  혼자 여행   일차 일정   튈르리 정원   오랑주리 미술관   루브르박물관   퐁피두센터   개선문 전망대 야경 뮤지엄패스  ,1,1
771,제주도  혼자여행  숙소 추천   게으른소나기 게스트하우스,처음 혼자하는 여행 물론 중간에 친구를 만나긴 했지만 친구는 친언니가 제주도에 살아서 그 집에 묶고  여성전용게스트하우스로 여자 혼자 여행  숙소 강추   아침조식 짱    바로앞이 바닷가   아무것도  ,1,1
772,서산 숙소 추천 서산 일주일 살기 숙소 서산  혼자여행  숙소,뚜벅이  여행 으로 서산에 가시거나 시내 일정이 많으시면 여기말고 시내 쪽으로 잡으시는 걸 추천드리네요   박  일 동안 묵었던 방입니다  호텔이라고 불리긴 하지만 사실은 모텔에 가깝습니다  그래도  혼자  ,1,1
773,부여 당일치기  혼자 여행   ,부여  여행  버스 투어로 갈까 했지만 새벽부터 움직이는 것도 너무 힘들고 궁남지 야경도 보고 싶은 마음이 커서 버스 타고  혼자  가기로 결정  근데  분 정도 여유두고 출발을 했지만 지하철 호선이 너무  ,1,1
774, 혼자 하는 제주 여행 일차,  생애 첫 혼여행 제주도 어디 아픈 곳 없이 잘 다녀와서 너무 다행이고 사고는 있었지만 ㅋ 큰일아니여서 다행이였다 느낀점 난 생각보다 혼자 잘논다 다음에 또  혼자 여행 갈거다 등등등 많지만 블로그엔  ,1,1
775,여자  혼자  유럽 여행    매번 동행 찾지 않고 즐겁고 안전하게  ,가서  혼자 여행 하는게 아니라 비슷한 나이대 별로 팀을 짜줘서 같이 여행한다는게 넘나 좋았어여   혼자서 여행하는건 국내 밖에 안해본 쫄보라 걱정 많았는데 이렇게 세미패키지 한방에 해결 되니깐 뭔가  ,1,1
776, 혼자 하는 유럽 여행     바르셀로나에서 로마  부엘링  ,로마에서의 숙소는 이번 여행의 유일한 한인민박이다  프라이드 민박이라는 곳인데  개인적으로는  음료수를 사서 저녁으로 먹었다  로마에서의 첫날이 끝났다   주 가까이  혼자 여행 하다보니 점점 심심해졌다 ,1,1
777,국내맛집여행 여수먹거리 길언니 목하식당 여수  혼자여행 , 국내맛집여행 하면서 느낀건데 맛있는 집은 불경기에도 웨이팅이 있다는  사람이 많아서 내부 전체를   국내 혼자여행  하다보며 느낀건데  혼자 밥 먹을 수 있는 곳이 은근 없더라고요  예를 들면  여수에서  ,1,1
778,안전한  여행 지 산 아구스틴 성당과 마닐라 대성당  혼자  ,마닐라를  혼자 서  여행 하는 것은 위험하게 들릴 수도 있으나  비교적 안전한 곳만 골라 다니면 괜찮다  마닐라의 안전한 곳만 돌아다녀 봤는데  이제부터 본격적으로 포스팅을 시작하겠다  공항에서 안전하게  ,1,1
779, 후쿠오카   월   혼자  후쿠오카  여행   일차  텐진 쇼핑  ,  일본 후쿠오카     후쿠오카  여행   일차  박  일 후쿠오카  여행 의 마지막 날  체크아웃 후  오픈시간에 맞춰서 갔더니 손님은 나  혼자 였다   피스 코스였고  웬일로 맥주가 안 땡기는 날이라  ,0,1
780,포토존 노을명소 혼자여행 인여행 구좌읍 숙소  그리고세화  ,여자 혼자가면 살짝 무서울  수 있어요  물론 학교 근처에 인가도 있지만 그래도 조심해서 나쁠 것은    제주도 동쪽 구좌읍  혼자여행 인여행 숙소  그리고 세화 게스트하우스  호점  소개  ,1,1
781,오사카  혼자여행    내가 일본여행 좋아하는 이유  ,오사카  혼자여행  내가 일본여행 좋아하는 이유     글 사진 락주 여행  시작 되게 설레는  남들이랑 같이 있을 때는 시끄럽기 때문에 쓰지 못하지만  나는 혼자 일하는 사람이기 때문에 상관 없다  그  ,1,1
782,  보라카이  혼자 여행     앰배서더 인 파라다이스  ,엉엉 너무 예뻐 ㅠ ㅠ  근데  혼자  물놀이 하려니까 핸드폰이 자꾸 걱정됐다  호텔 썬베드에 두고와서  나같은 잠죽자 여행  추구자에겐 더더욱  썬베드 누워있다가 덥길래 방에 들어왔다  방에서 에어컨 쐬다가  ,1,1
783,나 혼자여행  전라도 남원편,혼자서 떠나는 여행도 나름 괜찮은듯  남원혼자서여행  전남 혼자여행   남원코스추천  일상  여행  여자 혼자여행   여유  힐링 기다렸던 남원역 도착  버스 정류장도 나오면 바로 있지만 언제 올지 알수없다  ,1,1
784,강릉 혼자여행  신상 강릉카페 대관령옛길 카페마눌,사실 바로 옆 대관령옛길도 걷고 싶었는데 이날 강릉 혼자여행  끝내고 다시 집까지  시간 운전해야 해서 걷기는 부담되더라구요  이번에 혼자 강릉여행 준비하며 보니까 가보고 싶은 맛집이랑 카페 너무  ,1,1
786,폴란드 기차여행 그단스크  혼자 여행 하기  ,폴란드 기차여행 그단스크  혼자 여행 하기   폴란드 기차여행 그단스크  혼자여행  안녕하세요   제가 처음으로 휴가를 내고 떠난 곳이 바로 그단스크 여행입니다  폴란드 북부에서는  라고 해서  ,1,1
787, 혼자  떠난 첫 해외 여행  싱가포르  여행 기록  ,비싸서 혼자 가기가 구랬고 시장인가 머 이런곳에서 파는 곳은 한번 찍먹했었는데 너무 덥고 습하고   일차 기록  일차 기록  일차 기록  싱가포르여행  싱가포르 혼자여행   싱가포르여자 혼자여행   혼여  해외여행,1,1
789, 여행준비   큐슈  혼자여행    숙소 예약하기,원래  혼자 여행 을 가더라도  일본여행의 숙소는 꼭 비즈니스 호텔의 싱글 더블룸을 예약해서 혼자 사용했었는데 이번에는 숙박비는 조금 아끼고 다양한 음식과 술을 즐기자는 마인드로 캡슐호텔을  ,1,1
790,제주도  혼자여행   인 숙소  제주  인실 나 혼자 쓴다,제주도  혼자여행   인 숙소  제주  인실 나 혼자 쓴다 안녕하세요  집우집주  다방 객실 후기 먼저  현관에는 여행 전 마지막으로 볼수 있는 거울이 있습니다  우산도 항시 준비합니다  제주  혼자여행  숙소  ,1,1
791, 싱가포르      혼자여행   일차   에어프레미아  ,여행 첫날인  일 오전엔 회사에 잠시 출근해야 했어요  비행시간이 오후  시  분인 만큼 오후  시  제가  혼자 여행  달인 수준이라는 걸 엄마가 너무 잘 아셔서 쿨하게 혼자 다녀와   라고 말씀해  ,1,1
793, 혼자여행  전망대뷰 좋았던 문경 카페 미정원,여행에서 카페를 빼 놓을수가 없는데요 이번에  혼자여행 을 하면서 뷰 좋은 오미자 전망대 미정원에서 마셨던 오미자에이드가 지금도 기억에 많이 남네요  오미자에 관한 모든것을 보고 체험하고 맛볼수가 있는  ,1,1
794,모츠나베 라쿠텐지 하카타역 맛집 여자  혼자  해외 여행   인가능,원조 모츠나베 라쿠텐지 글 사진 세리율 여자 혼자 해외여행을 가서도 후쿠오카 맛집은 못참지  그  여자  혼자 여행 을 가도 먹을 수 있는  인 메뉴도 있고 한국인 입맛에도 잘 맞는 곳이었다   수 ,0,1
795,강릉 동해 바다 국내  여행   혼자  갈만한곳 안목 해변 경포 맛집  ,즐길거리도 많은 경포해변은 국내 동해 바다 중에서도 혼자 갈만한곳에 적합한 해수욕장이랍니다  다만  바다 여행 중에서도  혼자 여행  갈만한곳이랍니다  유난히 더운 이번 여름  여러분도 깨끗하고 푸르른  ,1,1
796,베트남 달랏  혼자 자유 여행  달랏시장구경   달랏 무이네  ,그랩도 잘 안잡혀서 쬐끔 당황했지만 나는 배불러야 하는 한국인이니까   무이네 사막투어는 또 언제올리냠   베트남여행  달랏여행  베트남여자 혼자여행   베트남여행추천  달랏여행추천  달랏슬리핑버스  ,1,1
797,국내 휴양지 남해 원예예술촌 여자  혼자  국내 여행 ,남해 원예예술촌은 국내 휴양지로 찾아도 좋을 힐링 코스였는데요   혼자 여행 이나 여자 혼자 국내 여행으로  혹은  혼자 여행 으로 찾아도 좋을 국내 여행이었어요 ,1,1
798,공부하는꿈  올라가는꿈   혼자여행 가는꿈 풀이 해몽,이러한 꿈에서는 여행이나 새로운 경험을 상상할 수 있으며  넓은 시야와 자유로움을 느끼는 모습을  혼자서의 탐험과 자유로움   혼자 여행 하는 꿈은 혼자서의 탐험과 자유로움을 상징할 수 있습니다  이 꿈은  ,1,1
799,매화 개화시기에 맞춰  혼자  국내  여행  봄꽃 구경하기,늘 그랬듯  혼자 여행 을 떠나 자유롭게 다니다 오려고 합니다  국내 봄꽃 매화 개화시기에 혼자 국내 여행을 다녀왔던 곳들이에요  대부분 유명한 곳이다보니 다들 잘 아실텐데 올해는 한방에 싹 돌아볼까 합니다  ,1,1
800, 제주   대  혼자  제주도 뚜벅이 여행      기록,혼자가는 여행인만큼 안전하게 잘 수 있는 호텔로 결정했어요  뚜벅이여행이라 공항근처로 제주연동에   혼자여행 을 오면 사진을 많은 못찍을 것 같아서  혼자여행  기록용으로 사진관을 열심히 찾아봤어요  ,1,1
801,제주  인 숙소  혼자  제주도  여행  플레이스캠프,제주  인 숙소 혼자 제주도 여행 플레이스캠프 제주 글  사진 쏠트몬 동생들과 갔던 제주도 여행에서   혼자 여행 을 와도 충분히 이것저것 즐길거리가 많더라고요  패션동은 확장 공사를 하고 있다네요  안  ,1,1
802, 혼자 하는 제주 여행 일차,빵종류도 귀엽  여기가 유명한 뽀토존인데  혼자 여행 온 저는 아쉬운대로 누끼라도 따서 해봅니다 하하하 칭구가 찍어달라고 하지 왜 안 찍었냐고  그말을 어케 해여ㅠㅠ 저 혼자왔다거 찍어달라고 어케  ,1,1
803,   혼자  일본 여행   다이슨 한국제품   탄  , 인실로 예약해서  일  만원 정도였는데  딱 일본의 비지니스호텔 사이즈인데 혼자 지내기엔 좋았다   혼자 여행 하니 찍어주는사람이 많이 없어서 아쉬운   갹  나가레카와  역에서 혼도리 가는길에 있는  ,1,1
804,해외  혼자 여행  필리핀 세부 시티 유적지 도심 투어,보홀에서 오션젯 페리를 탑승하고 해외  혼자 여행  필리핀 세부로 넘어왔다  이번에는 따로 호핑을 하지  작은 공간에 사람들이 사진을 찍는다고 줄을 서서 있어 제대로 혼자 해외여행하는 입장에서는 사진을  ,1,1
805,퇴사 후  혼자 여행 하기  일차,걷기 좋은 해맞이 공원 평일이라 그런가 길에 사람이 아무도 없어서 그 순간을 오롯이  혼자  느낄 수 있었다  램블러 어플 유저들은 여기도 뱃지 있으니 켜고 이동하시길ㅎ 이번  여행 의 목적은 해안도로 따라  ,1,1
806,제주도 호텔 케니 서귀포 제주  혼자 여행  숙소,제주도 호텔 케니 서귀포 제주  혼자 여행  숙소 제주도 여행 첫날에는 일행들보다 하루 먼저 도착해서 하루 혼자 숙박할 수 있는 곳을 찾다가 가게 된 제주 호텔 케니 서귀포 제주도  혼자 여행 으로 딱 알맞은  ,1,1
808, 제주도  여자  혼자  제주도  여행  애월 솔트  무인카페 산책  ,있었지만  혼자 여행  가면 우동까지는 오바고 모듬카츠정도가 딱 적당할듯싶다  내가 갔던 날에는  아르떼 뮤지엄으로 고우고우   제주도  여자 혼자 제주도 여행  애월 솔트  무인카페 산책  서황 돈가스   ,1,1
809, 혼자 여행  숙소 정하는 세 가지 방법은  조식과 전망은 우선  , 혼자 여행  숙소 정하는 세 가지 방법은  조식과 전망은 우선 순위 제외 금일은  혼자 여행 을 떠날 때  숙소 위치 어떤 테마를 정해 여행을 떠나기로 하셨나요  혼자 머물 숙소 위치는 테마에 따라 결정이 돼요  ,1,1
810, 혼자여행  통영  박 일 여행  일차   연화도  우도   , 나 혼자여행   혼자여행   혼자통영  통영  통영여행  통영항여객터미널  통영섬  연화도  우도  통영우도  연화도섬  섬투어  국내여행  찐후기  솔직후기  솔직담백한  내돈내고다녀온여행  여행후기 찐 오랜만에  ,1,1
811,경주 숙소 봉황맨션  경주  혼자여행  게스트하우스  조식  ,사장님께서 꼼꼼하게 안장 높이도 봐주시고 해서 겁쟁이 라이더인데도 안심이 되었다  평소에  혼자 서 자전거 탈 일도 정말 없었지만  이렇게 낯선  여행 지에서 지도를 보며 타려니 처음엔 엄청 긴장이 되었다  ,0,1
812,오사카  혼자 여행  코스  행복 여행      ,힐링 여행  혼자 갔지만 혼자가 아니었던 그때의 순간으로 여러분들을 초대합니다  오사카 여행  궁금하시다면    덴노지  텐노지  덴노지동물원  텐노지동물원  오사카여행  오사카 혼자여행  ,1,1
813,미국 여행 혼자 가는 여행  용기있는 여행 손주보러가기  ,하나  둘   셋  혼자 여행 은 두렵다 자녀방문이니 자녀믿고 출발하고 같이 이동하여 태워줘야하고  큰지라 ㅎㅎ 사는거 직접눈으로보니 안심   안심  혹시 잇님들도 혼자가는여행 기회되면 시도해보시길 ,1,1
