,title,description,title_label,description_label
0,여수 하멜등대  혼자 여행  다리 볼거리,하멜전시관까지 직접 관람을 하고 나니   혼자 여행 을 하기에도 괜찮은 명소겠다 싶더라고요  낭만포차거리로 이어지는 코스도 감성이 괜찮은지라  혼자 국내 여행을 왔다면 쭉 돌아보는 것도 괜찮을 겁니다  ,1,1
1,여자 혼자  국내 여행 갈때 김포 공항택시 예약 타다 넥스트,여자 혼자여행 할때 자주 이용합니다 오늘은 모빌리티 플랫폼 타다로 김포공항 택시를 대체한 후 편리하게 여자혼자국내여행을 다닐 수 있었던 경험을 공유해 보았습니다 기업고객을 위해 타다 비지니스도  ,1,1
3, 혼자  가는 바르셀로나  여행   일차       바르셀로네타  ,어느 쪽이 더 값진 경험인지는 단언할 수 없지만 그래도 혼자서 여행한다는 사실만으로 불안해 밤잠을   바르셀로나  스페인  유럽  바르셀로나여행  바르셀로나 혼자여행     라플라우  바르셀로네타  ,1,1
4, 도쿄  혼자 여행  일본관과 지구관 전시실 있는 국립과학박물관,첫째 날 도쿄  혼자 여행  하면서 점심 먹고 다녀온 곳은 국립과학박물관입니다  국립과학박물관은 오전 시부터 오후 시 입장은 오후 시  분 까지 영업을 하며 월요일과 연말연시 월  일 월  일 에 휴관합니다  ,1,1
5,제주도  혼자여행   일 차   서복전시관  소정방 폭포,제주도 뚜벅이  혼자여행   일 차   서복기념관  소정방폭포  돈가스 맛집 포가츠  유동커피 숙소에서  이렇게 정리하고 보니 첫날 엄청 걸었네요  혼자 한 제주도 뚜벅이 여행  다음 포스팅에서 계속됩니다 ,1,1
6,여자 혼자여행  일본 후쿠오카 게스트하우스 위베이스 추천,후쿠오카에서 여행중인 쥬디입니다   혼자여행 할 때 호텔은 부담스럽기 때문에 캡슐호텔이나 게스트하우스가 이용하기 딱 좋더라고요  그 중에서 평점이 가장 좋았던 후쿠오카 위베이스 게스트하우스에서  박  ,1,1
7, 년  일상기록  제주도  혼자여행  끝,혼자 뭘 한다는 게 낯설고 힘들어할 줄 알았는데 생각 기대 이상으로 너무나 잘 즐겼고   함께 떠나는 여행도 좋지만 오로지 나한테만 집중할 수 있는  혼자 여행  매력에 푹 빠짐 ㅎㅎ 퇴사하고 나서 아무것도  ,1,1
8, 제주도  여자  혼자  제주 여행  함덕해변  서우봉 둘레길,여자 혼자 제주여행  일차 서우봉과 함덕해변  년  월  일 유채꽃 가득 핀 서우봉 후기를 이제서야  난  대때  혼자 여행  다닐때도 기본  만보씩 걷던 사람인데  이젠 나이가  중반을 넘어가니 아주 죽을거  ,1,1
9,뉴욕 여자 혼자 여행  후기 팁   환전  트래블월렛  유심  ,사용한 결제 카드   트래블 월렛   신한 체인지업 체크카드   신용카드 호텔 결제    뉴욕 여행     혼자 여행 이었는데 길에서 셀카봉 세워놓고 혼자 사진도 잘 찍었어요    단  저는 아무 일 없이 안전하게  ,1,1
10, 혼자 여행 이 두려우시다면 유럽 패키지 추천드려요 , 역시 사람들은 다 똑같아  그리고 저는  혼자 여행 을 갈 계획이어서 훨씬 고되고 준비할게 배로  계시니 혼자 유럽여행에도 걱정 없더라고요  낯선 타지에서는 아무리 침착하고 차분하게 일을 해결한다고 해도  ,1,1
12,속초  박  일  여행 혼자  먹투어 , 만원에 난 아주 부자가 되었다  속초여행  속초 박 일  속초 박 일  속초 혼자여행   속초여자혼자  속초먹투어  속초먹방  속초맛집  속초점심  속초저녁  속초순두부  속초두부  속초김영애할머니  속초카페  ,1,1
14, 월의 지각일기  그리고 드디어  혼자 여행 을 떠난 이야기,   여행 출발 전까지의 기록  사진털기 달려보자고  월요일 점심도 든든한 도시락 한상 ㅋㅋㅋ  비행기  혼자  타는게 처음인 나  꽤나 으른스럽다 이심은 와이파이가 되는 환경에서 해두라고  ,1,1
15,여자  혼자  해외  여행  이스탄불 호텔 아다한 갈라타 탑 근처,싶은  여자 혼자여행  이스탄불 다녀왔었던 후기 남겨 보려고 해요  박 일 동안에  여자혼자해외여행 하기에도 위치가 좋았고 주변이 밤 늦은 시간까지도 활기차고 번화가라서 전혀 무섭지 않았었던  이스탄불호텔  ,1,1
16, 혼자  가는 바르셀로나  여행   일차   보케리아 시장  사바테르  ,혼자 하는 여행으로 나를 깊숙이 알아간다는 사실을 새삼스레 깨달았던 하루였다   바르셀로나  스페인  유럽  바르셀로나여행  바르셀로나 혼자여행   보케리아시장  바르셀로나고딕지구  ,1,1
17,여자  혼자 여행  수원 노송지대 노송공원과 등나무 명소 삼풍가든,어제도 혼자 사진 찍으러 간 곳에 여자  혼자 여행  온 분이 있어 자연스럽게 정보교환도 했어요  며칠 전  번이나 등나무꽃 보러 방문한 삼풍가든에도 수원 여행 혼자 온 분이 몇 있었어요  꽃도 보고 노송지대  ,1,1
18,미국 여행  경비 아끼는 꿀팁   혼자 면    명 이상이면  ,특히 미국 여행은 혼자 일대 가장 돈이 많이 들고  명 이상    명 정도면 가장 돈을 아낄 수 있습니다  아무리 저렴해도  만 원 이상이기 때문에 코로나 이후로는 사실  혼자 여행 한다면 어쩔 수 없지만  명  ,1,1
19, 혼자   박  일 괌  여행  준비,혼자  박  일 괌 여행 준비   에어텔 예약 에어텔이 뭔지 몰랐는데 항공   호텔 패키지라고 픽업 샌딩도 포함되어  혼자 여행 에 딱 모두투어 패키지 제주항공   두짓타니 클럽룸  박  일로 예약 숙박비는 혼자  ,1,1
20,제주도  혼자 여행   일차,이래서 혼자 자연과 가까운 곳으로 여행가나 싶더라 돌탑이 많길래 나도 슬쩍 쌓았다 돈 많은 백수되게  분위기 하나는 짱짱맨 제주도 어디서나 볼 수 있는 귤나무 내 직장 선생님께서  혼자 여행 간다고 커피  ,1,1
21,도쿄  혼자여행   일차  디즈니랜드 혼자 뿌시기, 놀이동산  혼자 간것도 처음   혼자  가는것도 재밌을까 고민했는데 괜히 고민했다 ㅠㅠ 디즈니는 디즈니다  싶었구 너무 재밌음  혼자  도쿄 여행  가시는 분들 꼭 디즈니랜드 가보세요  혼자 도 존잼입니다,1,1
22,뉴욕 여자 혼자 여행  후기 팁   항공권  호텔  공항 이동  ,뉴욕 여자 혼자 여행  후기 팁  항공권   호텔   공항 이동   지하철   마스크 뉴욕에서  박한 하얏트    저는 혼자 파리  런던  프라하 여행 경험이 있고 대중교통을 무서워하지 않아서 지하철을 이용했는데  ,1,1
23,제주 혼자여행  당일치기 드라이브 코스 제주도서귀포가볼만한곳  ,제주  혼자 여행  하며 산책길을 걷고 좋은 풍경 보고 이런 혼자만의 여행을 좋아하시는 분들도 가끔 있더라고요 가끔 서귀포항을 나가고 들어오는 고깃배들도 볼 수 있습니다 그러고 보면 작은 배들이 움직이는  ,1,1
24,여자  혼자 여행 할 때  괜찮은 선택지   인실 게스트하우스 추천  ,둘이 여행할 때는 보통 호텔에 간다  하지만  혼자 여행 할 때 한 명 가격이나 두 명 가격이 같은 호텔을    여름 포항 울산 부산  박 일 여자 혼자 뚜벅이 여행 프롤로그   교통 기차 버스 택시  일정  숙소  ,1,1
25,여자  혼자  해외  여행  유럽 남프랑스 뚜벅이를 위한  여행  코스까지 , 혼자여행   혼자해외여행  여자 혼자여행   여자혼자해외여행  뚜벅이여행  남프랑스뚜벅이  프랑스여행  유럽여행경로  혼자유럽여행  여자혼자유럽여행  유럽여행코스  남프랑스여행코스  프랑스여행코스  ,1,1
26, 년  일상기록  제주도  혼자여행   일차,주문가능해서  혼자  먹기엔 넘 많았지만 고기 먹고 싶어서 배터지게 흑돼지와 마무리 이러니 배탈이 나고도 남았지  휴 오늘 너무 힘들었지만 또 행복한 하루였ㄷ    이날은  여행  중에 젤 고단하고 힘든  ,1,1
27, 대구 혼자여행   이현공원  수국   대구 서구 가볼만한곳    월  ,저는 뚜벅이 여행자라서 대중교통수단인 버스를 타고  서구문화회관 앞  버스정류장에 내려  ㅎㅎ 이때도 혼자서 촬영하고 싶어서 삼각대를 이용해 보았답니다  인물사진을 좋아하시는데 대구 혼자여행 이라면  ,1,1
28,시드니  혼자여행     유심칩사기 콜스   울월스   시드니 공항 , 심은 배터리가 좀 더 빨리 닳는다 굳이 나는  혼자 여행 하는데  가 필요할까 라는 생각에 그리고 배터리는 여행하면서 생명이니까 시내에서 유십칩 사기로 결심  못 찾아 갈까봐 메모장에 시드니 시내  ,1,1
29, 혼자  가는 바르셀로나  여행    준비 편,바르셀로나를  혼자 여행 하는 사람들은 호스텔을 많이들 이용한다는 글을 봤기에 내린 선택이었다  보수적이기로는 이루 말할 수 없는 집안인데 딸내미가 혼자 해외여행을 하는 것과 더불어 혼성  ,1,1
30, 혼자  떠난  여행  밀양숙소 하우하에서 힐링,하우하 혼자 떠난 밀양 여행 하우하에서 힐링했어요 요즘 들어 일태기인지 스트레스 시달리던 나 감사하게도 팀장님께서 휴가를 주셨다 사람을 많이 만나는 직업이다 보니 아무도 없는 조용한 곳에  혼자 여행  ,1,1
31,여자 혼자  유럽 여행 도 유럽세미패키지로 안전하게 ,여자혼자 유럽여행을 찐하게 즐기고 싶어서 나만의 일정으로 여유롭게  혼자 여행 하는 시간도 가졌답니다  유럽세미패키지여행을 신청해서 한 달간 유럽여행이 더 편하고 재미있었어요  유럽세미패키지에서  ,0,1
32,여자  혼자  유럽 여행  안전한 도시    ,오늘 특히 여자 혼자 떠나는 유럽여행 가장 안전한 도시     참고하셔서 여행하실 때 이런 도시는 여자분들뿐만 아니라 남자분들도  혼자 여행 이 가능한 도시라는 거 참고하시면 좋을 것 같습니다  위 포르토  ,1,1
33,여자  혼자  떠난 인도  여행  바라나시 갠지스강 노을 보며 시작된  ,나는  혼자 여행 할땐 인도에서 길거리 음식을 사먹지 않았는데 이런 음식들도 거리낌없이 먹는  가  남자 동행이 있으니  여자 혼자 인도 여행을 하고 있을때 보다 안전하고 보호 받는 느낌이 들었다  이  ,1,1
34,도쿄  혼자여행   일차  맛집  숙소  갈만한 곳 추천,퇴사 후에 휙 떠난 도쿄  여행  후기   혼자 서 처음가는  여행 이라 두근두근  일차 공항   스카이라인   렘롯폰기 숙소 도착   신주쿠 구경   규까츠   로프트   가부키초 구경 창가에 앉아서 풍경 보면서 일본 도착  ,1,1
35,뉴욕 여자 혼자 여행  후기 팁 물가  지방세 소비세  택스  팁  ,  저는 혼자여서 매일 베개 옆에  를 두고 나갔어요      뉴욕 먹을거리에 대한 이야기    양 적은  혼자 여행 하는 여자분들은 음식 양 잘 생각하고 여행 계획 세우세요      ,1,1
36,여수  여행 코스  혼자  뚜벅이  여행 지 다녀왔어요,오랜만에 혼자 전라도 여행을 다녀왔는데요  서울에서 전남은 차로 가기에는 부담스러워서  를 타고  그리고 요즘 전시에서 사진이 또 빠질 수 없는데  혼자 여행  가도 거울을 통해 촬영이 가능한 전시  ,1,1
37,소형케리어 나  혼자 여행 에 딱이예요 ,특히 혼자 갔던 여행이다 보니까 무엇보다도 보안이 가장 중요한 부분이었어요  친구들과 함께 가면 잠깐 자리를 비워야 할 때 짐 걱정 없이 돌아다닐 수 있는데  혼자 여행 을 하다 보니 그럴 수가 없어서 꼭  ,1,1
38,  여름 포항 울산 부산  박 일 여자  혼자  뚜벅이  여행      ,  여자  혼자 여행 할 때  괜찮은 선택지   인실 게스트하우스 추천   포항 오다가다   부산 싱글싱글   여름 포항 울산 부산  박 일 여자 혼자 뚜벅이 여행 프롤로그   교통 기차 버스 택시  일정  숙소 인실  ,1,1
39, 혼자  떠나는 스페인  여행  렌페 기차  타고 발렌시아로, 그까짓 거 혼자 잘 수도 있지 그게 뭐라고  호들갑이야  할 수 있는데  소심 대마왕인 나에게는 이조차도 용기다   살에 첫 해외여행이자  혼자 여행 이었던 일본 배낭여행 이후 몇 년 만인지 감개가 무량할  ,1,1
40, 년  일상기록  제주도  혼자여행   일차,  일상 제주도  혼자여행   일차 벌써 제주도  일차  제주도 일정 중 젤 기대됐던 곳  가파도  홀로여행기   오늘도 시트콤인생  졔 수난시대 앞으로도 계속되니 기대해주세여  ,1,1
41,  나트랑 여자  혼자 여행 하루종일 먹고 수영하고 돈 쓰고,ㅋㅋㅋ 진ㅋ짜ㅋ 아무 생각없이 다닌 나트랑   여자 혼자 나트랑  나트랑 여행   나트랑맛집  아리야나  여자 혼자 해외 여행   나트랑마사지  나트랑맛집  나트랑담시장  담시장  담시장착한할아버지  ,0,1
42, 방콕 파타야  혼자여행  파타야 이발하기  헤어살롱  , 방콕 파타야  혼자여행  파타야 이발하기  미용실 이발소  날씨가 무척 좋았던 파타야  여행 전에 일기예보를 보니까  주일 내내 비가 온다고 되어 있어서 걱정했는데 의외로  주간의 여행기간 중 비가 제대로 온  ,1,1
43, 혼자  부산 기차  여행  부산 용두산 공원 전망대 볼거리 부산 타워,도착해서는 렌트카로 이동하니 시간도 절약되고 얼마나 편하고 좋은지 종종 혼자 부산 여행을 다녀와야 할듯하다  부산 기차여행 부산  혼자 여행    부산 용두산공원 주소  부산 중구 용두산길   운영시간  ,1,1
44, 유럽 포르투갈 여행 포르투  박 일 나 혼자여행 이지젯  ,ㅋㅋㅋㅋㅋㅋ 열쇠 화장실은 개인용이지만 방 밖에 있다 ㅋㅋㅋㅋㅋ 속았다  혼자 쓰기에 좋은 방과 욕실 숙소에 짐을 풀고 본격적인 포르투 여행  시작  저 마차같은 빨간차 타보고 싶군 걷다보니 더웠다  ,1,1
45,후쿠오카  혼자 여행  코스 일정 오호리공원 맛집,오호리코엔 산책하고  혼자  맛집에서 식사까지 큰바다소년   늘  혼자  떠나는 후쿠오카  여행 은 지난  월 다녀온 후기입니다  구시다신사에서  년 처음 활짝 핀 벚꽃을 보고는 다음날 오전에 찾아본  ,1,1
46,영월 여행코스  박 일  혼자여행  경비 총정리,영월 여행코스  박 일  혼자여행  경비 총정리 나 진심 이제 막 와서 피곤에 쩔쩔매고 있는데 다녀온 거  여기서 혼자서 다른 사람들과 단절된채 살다가 어린 나이에 돌아가셨다는게 참 씁쓸하고 안타까웠다  ,1,1
47,도쿄  혼자여행   일차  츠키지시장  긴자 맛집 카페 추천,도쿄여행 마지막날 ㅠㅠ 시긴이 정말 순삭이다  혼자도 이렇게 재밌다니  도쿄여행  일차 긴자   센트레  도쿄 여행도 처음   혼자 여행 도 처음이었는데 볼게 너무 많고 할것도 너무 많아서  혼자 여행 하기에도  ,1,1
48,여자 혼자  파리 여행      오르세미술관  오랑주리  ,  여자혼자 파리여행  박 일   파리에서 다섯째날 스타트    일째부터는  혼자여행 이 아닌 친구들이랑 함께   혼자 여행 을 선호하는 사람이라 자유시간이 필요한데 이번에는  이상을 함께여행함  이건  ,1,1
49,오사카   프리미엄 캡슐호텔 신사이바시점  혼자 여행  ,    헤드위그 오사카   프리미엄 캡슐호텔 신사이바시점  혼자 여행  하기 편한 숙소 오사카  소통하면서 여행을 다니곤 했다  펜데믹 후에 하늘길이 열리면서 다시 한번 해외로 나가게 되면서 혼자  ,1,1
50,단양  혼자 여행   일차,단양  혼자 여행 을 키워드로 검색 했을 때 이곳이 적합할 것 같아서 썸데이 게스트 하우스를 택하게 되었다  평일에 가는 여행이고  평일엔 여행객이 많지 않을 것 같아서  인 실을 택했는데 운 좋게도 혼자  ,1,1
51, 혼자 여행    안동 여행코스 및 여행지 추천,혼자 안동 여행을 다녀왔어요  가기 전에 안동에서 대학을 나온 지인과 안동이 고향인 인친님들의  고른 여행지 및 여행코스였는데 결과적으로 아주 만족스러웠어요   혼자 여행  안동 여행코스 및 여행지  ,1,1
52,나  혼자  일본  여행  유후인 나나카와 료칸,객실에 혼자 묵는 경험은 정말 특별했어요ㅎㅎㅎ 승무원 시절  혼자 여행 을 정말 많이 했고 혼자서도  함께 하는 여행은 물론 즐겁지만 나는 이상하게도 나중에 돌이켜볼 때 혼자 떠났던 여행이 더 오래오래  ,0,1
53,강원도 강릉  혼자 여행    초당순두부마을 맛집  동화가든 본점  ,바로  혼자 여행 하기  백수 시절을 보내고 있는 지금이 적기라서 더 늦어지기 전에 호텔 특가 떴을 때 바로 여행 일정을 잡았다  일단 숙소만 잡고 아무 계획 따위 없는  의 여행 출발 전 친구네 회사 앞에서 커피  ,1,1
54,여자  혼자  부산 여행    광안리 혼술 하기 좋은 광안사카바  ,정말 오랫만에 여행다녀온 부산  그리고 광안리와 사랑에 빠졌습니다 다음에도 부산가면 꼭 광안리로   혼자여행 의 좋은점  혼자라 어디든 잘 낑겨서 먹을 수 있습네다  이래서 광안사카바를 광안리 혼술하기  ,1,1
55, 태국 방콕 혼자여행  팟퐁 야시장 구경   방콕   신용카드로  ,야시장은 크게 볼 건 없었는데 예상치 못한 버스킹 공연으로 나름 즐거운 저녁시간을 보낸 것 같다  숙소 근처 와서 라이브펍에서 공연과 맥주를 더 즐기다가 잤다   태국여행  방콕 혼자여행   팟퐁야시장  방콕 ,0,1
56,제주 관광지 제주도 수국 명소 제주 숨도  혼자여행 ,항상 남편과 함께 제주도 여행을 했지만 이번에는 제주  혼자여행 을 하게 되었다  뭐  혼자여행 하는 것도 나쁘지 않다  수국정원을 배경으로 한라산과 서귀포시의 모습이 오버랩 되었다  그래서 그런지  ,1,1
57,여자  혼자  대만 타이베이 자유 여행    말할수 없는 비밀의 그 곳  ,대만 여행 단수이   대만 홀로 여행 이야기 계속해서  대만에서의 혼자만의 시간을 즐길수 있는   단수이  대만단수이  타이베이단수이 단수이는  혼자여행  뚜벅이들에게 참 가기좋은곳  물론 전철 완전  ,1,1
59,일본 후쿠오카  혼자여행 인천공항에서 후쿠오카공항까지 시간  ,일본 후쿠오카  혼자여행  인천공항에서 후쿠오카공항까지 시간 때우기 인천공항에 일찍 도착 후 체크인 카운터 위치 확인했어요  저번 여행때 못 본 장식들이 있어서 잠시 구경  제주항공 카운터는  카운터  ,0,1
61,대학생 여자 혼자  스페인 여행  후기   로맨틱유로 세미패키지,여자혼자 스페인여행이었지만 이 때 만난 친구들이랑 아직까지 연락하고 일년에 몇번 씩 만나는 찐친이 되었답니다   혼자 여행 하는 것에 대해서 살짝 걱정이 되거나 멋진 여행지에서 새로운 친구들과 함께  ,0,1
62,오사카  혼자 여행 코스 나카자키초 카페거리 살롱드아만토 추천,오사카로  혼자 여행  갔던 날이에요  혼자서 일본 여행은 처음이라 살짝 긴장된 마음을 가지고 있었는데요  여행을 시작하기 전 인스스에  오사카 갈만한 곳  멋진 곳 알려주세요  하고 올린 저의 질문을 본 제  ,1,1
63,제주도  혼자여행  당일치기 버스투어하고 인생샷남긴 리뷰,오늘은 제주도  혼자여행  꿀팁을 좀 리뷰해볼까해요  머리 아프게 제주에서 렌트카와 숙소를 생각하지 않아도 제주도 당일치기 버스투어가 가능하고 아무래도 혼자이다 보니 내 사진은 항상 남지 않고 풍경  ,1,1
64,일본  혼자여행  계획할때 알아두어야할 기본정보,그러나 상황이 바뀌고 있으며 최근 몇 년 동안  인 여행객을 위한 플랜을 제공하는 료칸이 많이 증가했습니다  일본 혼자여행  식사 일본에서 혼자 식사하기가 쉬워졌으며 많은 장소에서 혼자 식사를 할 수 있도록  ,1,1
65, 안동 숙소 혼자 여행 안동풍경호스텔     도미토리 후기,채우고  혼자 가려니까 이것저것 챙김 ㅋㅋㅋ  가다가 처음 만난 휴게소에서 점심겸 저녁도 먹었어요  북스테이 한번 더 도전해보겠습니다   안동여행  안동북스테이  안동 혼자여행   안동숙소  안동숙소추천,1,1
66,일본 후쿠오카  혼자여행  이치란 본점 돈코츠라멘,일본 후쿠오카  혼자여행  이치란 본점 돈코츠라멘 일본 후쿠오카  혼자여행 의 첫 일정은 이치란  저번 여행 때는  시간영업 안 했는데  이제 관광객이 많이지니  시간 영업을 하네요  주말 아침 웨이팅   ,1,1
67,공주  혼자여행  숙소 슬로크루즈 더블룸 후기,슬로크루즈 공주  혼자여행 에 적당한 호텔 공주여행 숙소로 지냈던  슬로크루즈 에 대한 후기입니다  슬로크루즈는 커뮤니티 호텔이라는 이색적인 컨셉을 갖고 있어요  혼자 조용히 지낼 사람들은 조용히 지낼 수  ,1,1
68, 혼자 여행 한다는 건 , 혼자 여행 한다는 건  점심으로 걸어 다니며 빵을 먹어도 된다는 거다  먹는 것에 신경 쓰지 않고 가고 싶은 곳에 갈 수 있다  혼자 하는 여행은 배가 고프지 않다  몸의 모든 감각이 깨어 있다 보니 식욕에게  ,1,1
69,일본  혼자 여행  도쿄 숙소 추천 이비스 스타일 긴자 호텔,오늘은 특히 혼자  도쿄여행 갈 때 추천하는  긴자호텔 이비스 스타일 도쿄 긴자        ㅎㅎ 그래도 있을 건 다 있고 나름 아늑해서  혼자여행  할 때 숙소로 딱이에요  혼자 자기에 부족함 없는  ,1,1
70,부담없었던 전주  혼자여행 ,부담없었던 전주  혼자여행  최근 혼자서 여행을 다녀오시는 분들이 많아졌는데요  내가 원하는 날짜 시간과 장소를 선택하여 마음껏 돌아다닐 수 있다는 장점에 많은 여행객이  혼자 여행 을 선택하고 있습니다  ,1,1
71,춘천 김유정역 사진찍기 좋은곳 국내  혼자 여행 ,이렇게 국내  혼자 여행  삼아 찾은 사진찍기 좋은곳  춘천 김유정역을 소개해 보았습니다  조용조용한 여행지로 경춘선 전철을 이용하다가 잠시 구경하기 좋은 곳이었어요 ,1,1
72,시드니  혼자여행      왓슨스베이    ,작은에뚜알의 시드니  혼자여행 기   첫째날 두 번째 이야기 입니다   인천공항   시드니  아마 시드니 여행하시면서 지겹도록 가게 될 거예용 ㅎㅎ 저는    번으로 가서  게이트에 탑승  ,1,1
73,여자 혼자  파리 여행      팔레루아얄      ,여자혼자파리여행 둘째날 이렇게 끄으읕 여자혼자파리여행 여자혼자유럽여행 파리여행 프랑스여행  카페아티산 파리카페추천 파리 혼자여행 맛집 친구랑파리여행 파리 일여행 센강산책 에펠탑피크닉,1,1
74,국내  혼자여행  방법 우중캠핑 그리고 여행준비물, 혼자여행 을 생각해 보면  지금까지 해외여행을 혼자서 해본 경험이 없으며 국내  혼자여행 이  였으므로 기억된다  그리고 그  혼자여행 은 많은 경우가 캠핑을 수단으로 하고 있기에 여행준비물에 먹거리가  ,1,1
75, 년  일상기록  제주도  혼자여행   일차,제주도  혼자 여행 하시는 분들도 많고  생각보다 남 눈치나 신경 쓰지 않고 혼자만의 시간을 온전히 즐기는 내 자신에게 너무 놀랍고   이번 여행은 나한테만 집중하기 위해 온 것이기에 이 시간 잘 즐겨보는걸로  ,1,1
76,경주  혼자여행   탄   낮의 동궁과 월지  첨성대  예쁜  ,갔는뎈ㅋㅋㅋ  혼자 있고 싶었어여  사람 두명이 있었다  근데 내가 옆에 앉으니까 금방 일어나길래  보러가기   경주여행  동궁과월지  첨성대  경주  여행  혼자여행   국내여행  경주여행지  여행지추천  ,1,1
77, 혼자  제주도  여행  마냥 즐기기 첫째날    강한추천 ,하다가 혼자 떠납니다  정말 잘 다녀왔다 생각이 드는 혼자 제주도 시작   부산 가자는 친구들의 유혹  렌트를 하실 분들은 미리 하고 가시는것 추천   혼자 여행 하는거라 더욱 차가 필요하다고 생각했다  ,1,1
78,울산 대왕암공원 출렁다리 익사이팅 울산  혼자 여행 ,유유자적하며 여유만만하게 즐기는  혼자 여행  이렇게 또 울산 여행의 한 곳에 발자국을 남기고 발길을 돌리면서 느끼는 감성은  나이테가 많아질수록 혼자 잘 노는 것도 능력이고 기술이란 생각이다  ,1,1
