,title,description,title_label,description_label
248,내가 만난 용감한 여자들의  혼자  하는  여행 ,혼자인 여행자들도 많아졌습니다  집시처럼 캠핑카를 집 삼아 뉴질랜드 하늘 아래를 떠돌던 키위 어르신들도 혼자이신 분들이 아주 많고  특히나  혼자 여행 하는 여자들이 많아졌습니다  모르죠  우리가 우연치  ,1,1
250, 싱가포르 여자 혼자 여행  아시아나 비즈니스탑승,출국 전날 밤에 찾은 여권  못찾는거 생각해서 어캐해야하는지 다 찾아보고 여권 찾음 ㅎㅎ 초록색 여권갬성도 좋은데  여행 준비로 모자사고 크록스 샀음 이것저것 담고 음식도 좀 챙겼더니  키로다 ㅋㅋㅋ  ,0,1
251,부산 해운대  혼자 여행  코스 해운대해수욕장 놀거리  ,알차게 여행을 즐기셨으면 좋겠습니다 부산 해운대  혼자 여행  코스   해운대시장 주소   부산 해운대구 중동 로   영업시간   가게마다 상이 첫 번째로 소개드릴 부산 해운대  혼자 여행  코스는 부산을  ,1,1
252, 태안 여행  안면도 뚜벅이  혼자 여행 ,그러나 너무 시골이고 대중교통이 잘 되어있지 않아 뚜벅이로  혼자  가거나 많은 볼거리를 기대하고 가면 실망할 수도 있다  친구나 연인끼리는 캠핑  가족 여행 시에는 안면도에서 손꼽히는 리조트인  리솜리조트  ,1,1
253,사파 여행   혼자  가기,혼자라 그냥 미싸오보      소고기 볶음면을 시켜서 맥주랑 마셨는데요  여기    는  했는데   혼자 여행 오거나 가족 여행객들에게도 괜찮은 식당인거 같습니다  그냥 지나가다 들어간  ,1,1
254,런던 타워브리지와 갤러리 방문하며  혼자 여행 ,런던 혼자여행  보내줬었던 이야기를 자세하게 풀어봤었는데요  제가 생각했던 것처럼 런던이라는 나라는 고풍스러우면서도 현대적인 느낌이 강했기 때문에 만족하며 구경할 수 있었죠  그래서 다음에는 혼자가  ,1,1
255,제주 서쪽  혼자여행  제주도 미술관 저지문화예술인마을 제주  ,제주여행을 하다 보면 자연스럽게 접하게 되는 것이   사건인데 그것을 주제로  미술제가 열린 것이  만약 제주  혼자 여행 을 와서 조금 더 깊숙이 제주의 역사와 예술을 마주하고 싶다면 제주 서쪽  ,1,1
257,여자 혼자  국내 여행    부산편  부산역 근처 본전돼지국밥 너무  ,부산 외국인 많네  ㅋㅋㅋㅋㅋㅋㅋㅋㅋㅋ 웅 그래  우선 호텔 체크인 하자   여자 혼자여행   부산여행  부산여행코스추천  여자혼자국내여행  부산편  부산꼭가볼만한곳  부산맛집  부산돼지국밥추천,1,1
258, 혼자 하는  여행 ,물론  혼자 여행 을 하면  그리고 나처럼 아무와도 말하지 않는 여행에서 박장대소하는 즐거움과 재미는 없다  하지만 나도 모르게 이런 저런 상황을 생각하다보면 혼자하는 여행이 편하게 느껴진다  그리고 나의  ,1,1
259, 자전거 여행 혼자   박 일 금강종주 세종보 대청댐 인증센터,채비를 모두 마치고 체크아웃 나말고 여행중인 분들이 더 있었나보다  잘 쉬고 갑니다  멀리보이는  ㅇㅡㅇ   세종시를 벗어나는 길 시원시원  혼자여행 은 좋지만 또 외롭다    좋은 풍경이 나오면  ,1,1
260,대만 여행 프롤로그 타이베이  결혼 후 첫  혼자 여행  떠나다 ,누리겠다고 혼자 왔나 싶고 걷다가 놀이터만 봐도  지나가는 아이들만 봐도 이로 생각이 나더라  이번 여행을 다녀오며 힘들어도 아이를 꼭 데려 다녀야겠다 생각했고 당분간 내  혼자 여행 은 없을 거라  ,1,1
261,여주 혼자여행  남한강의 비경을 품은 신륵사, 여주여행  신륵사  여주신륵사  여주 혼자여행   혼자여행  여주 혼자여행 일         여주 여행 신륵사  길치  네비도 제대로 못 보는 나를 보며 혼자 웃었다  여주 신륵사 입장료는 개인  원 청소년  군경   ,1,1
262,다채로운 매력의 뉴욕  혼자여행 ,좋은 여행지라고 할 수 있습니다  또 명소들이 근처에 모여있어서 뉴욕 혼자여행 을 가시려는 분들도 걱정없이 돌아다니실 수 있는데요  천천히 걸으면서 화려하고 환상적인 뉴욕의 거리를 만끽하시며 즐거운  ,1,1
263,여자 혼자여행  일본 후쿠오카 하카타캡슐호텔   ,일본 후쿠오카  여행 중인 쥬디입니다  첫째 날 묵었던 하카타역에서 아주 가까운         수건 어메니티 있을건 다 있어서 좋았어요  다음에도  혼자 가게 된다면 하카타캡슐호텔 또 이용하고 싶어요 ,0,1
264, 필리핀 보홀 혼자여행 준비  보홀 여행 준비하기,  보홀  혼자 여행  준비하기    박  일 일정으로 필리핀 보홀로  혼자 여행 을 간다   년도 이  처음 혼자 하는 해외여행이라 미리미리 준비했다    여행 준비물 체크하기 한번에 생각하려면 분명  ,1,1
266,서울근교 영종도  혼자여행   박 일 다녀오기 ,이번 주말은 즉흥 영종도 혼 여행  목요일  시에 급 금연가내고 숙소예약하고 저녁팀회식하고 집에  이었음 나올때 따지고 나오려다가 버스시간때문에 그냥 나왔다ㅠ 생각해보니 찝찝하네 안에 여자 혼자  있는  ,1,1
268,대성당 종탑 오르기  전망대   파리 여행   일차  여자 혼자  유럽 여행 ,파리  노트르담 대성당 종탑 오르기  파리여행  여자혼자유럽여행 노트르담 대성당은  년  파리 여행기를 다시 올려보려 한다  파리  혼자 여행   일차 일정   노트르담 대성당 종탑 내부 관람  ,1,1
269,제주  혼자 여행  숙소 플레이스 캠프 제주 스탠다드 예약,해서 혼자 제주 여행을 떠날까 생각도 해보았는데 생각처럼 행동하는게 쉬운 일이 아니더라구요 ㅜㅜ 그래서 올해는 꼭  버킷리스트 중 하나인 제주  혼자 여행 을 떠나보려고 계획 중인데요 제주도는 어딜가나  ,1,1
270,전북 여행지 추천 국내  혼자 여행  한적한 여행지 구 남원역,전북 여행지 추천 국내  혼자 여행  한적한 여행지 구 남원역 혼자서 남원 여행을 갔는데 광한루원 등을 구경하고 나니 기차 시간까지 약간 애매하게 남았더라고요  가까운 곳에 춘향테마파크가 있기는 한데  ,1,1
271,여자 혼자  뉴욕 여행   여행 준비물 미국  ,그럼 카샤는 이만 뿅    뉴욕여행  여자혼자뉴욕여행  여자 혼자여행   미국여행  여자혼자미국여행  미국   미국이심  뉴욕   뉴욕이심  뉴욕여행준비  뉴욕여행준비물  뉴욕스마트패스  뉴욕패스  앳홈트립,1,1
272,여자 혼자 해외 여행  서유럽 여행 코스 이탈리아 피렌체 우피치미술관,여자혼자유럽여행을 하면서 처음으로 오디오가이드를 우피치미술관 투어에 이용해 봤는데  혼자여행 이니 자유롭게 그리고 작품을 감상하며 인문학적 역사적으로 깊이 있게 이해할 수 있었습니다 그 시대의  ,1,1
273,도쿄       친구들과 헤어지고 진짜 도쿄  혼자 여행  시작  ,증말 너무 너무 행복했고 재밌었다 다시 요코하마를 와도 이 이상으로 행복하고 재밌는  여행 은 못 할 거 같다 앞으로 남은 일정은  혼자  다녀야 한다니  핸드폰 풀충  보배 필수 요코하마역에서 도쿄역까지  ,1,1
274, 혼자 여행 하기 좋은 아시아 국가  선,코로나 이후 떠오르는 여행 트렌드로는 단연  혼행 을 꼽을 수 있다  팬데믹 이후 혼자 하는 활동에 관심을 가지는 사람이 많아지면서  혼자 여행 을 하는 이른바  혼행 의 인기가 급부상했다  전문가들은  ,1,1
275,서울 봉은사 홍매화  혼자여행  매화 개화시기,봉은사 홍매화가  월 초에서 중순이면 활짝 핀다는 소식을 듣고 오늘 오후에 서울  혼자여행 을  아직까지 혼자 다니는 여행을 한 번도 해본 적이 없어서 이렇게 혼자 다녀왔다는 것만으로 스스로 칭찬하면서  ,1,1
276,서울 궁궐 당일여행 경희궁 구경 단풍 여행 서울  혼자여행 ,혼자 서울 여행의 시간은 평상시에 부는 바람과 다른 결의 바람이라 달콤하지 않아도 소중하단 생각을  경희궁 서울 궁궐 나들이로 단풍 구경도 맘껏한 서울 여행이었어요  서울  혼자 여행 으로 지하철타고  ,1,1
277,서울 궁궐 경복궁 벚꽃 봄나들이  혼자여행 ,서울궁궐 경복궁 벚꽃 봄나들이  혼자여행  여행일   년  월  일 봄비가 내리면서 날씨가  늘 가을에만 경복궁을 갔었는데 봄도 예쁘다고 해서 봄에 한 번도 가보지 못해 시간 내서 혼자 다녀왔습니다    ,1,1
280,남다른 대구  혼자 여행 ,규모가 크고 탁 트여있어서 아이들과 방문하는 가족 여행객들도 많이 볼 수 있습니다  대구  혼자여행 으로 방문하면 좋을 명소들을 쭉 알려드렸는데요  그 밖에도 대구에는  타워  팔공산케이블카 옥연지  ,1,1
281, 혼자  해외 여행  일본 북해도 겨울  여행 지 추천 홋카이도  여행  ,겨울 혼자 해외여행 하기 위해 출국해 홋카이도 가와카미 마슈 호를 보고 돌아왔던 날도 기억이 나네요 사실  혼자여행  이라고 해도 현지 사람과 한국 분까지 해서 목적지에서는 셋이 여행하긴 했지만 가족이나  ,1,1
282,여자  혼자  제주 여행   일차  사진일기, 혼자 여행 하기 참 좋은 날이다  애월에 힘입어 즉석으로 나홀로 제주여행 루트를 짜기 시작했다   가성비호텔   제주여행 여자혼자제 나홀로여행 혼자제주여행 비오는날제주 국내여행 여행일기  ,1,1
283,제주도  혼자 여행  함덕해수욕장 서우봉 유채꽃 추천,어디를 가더라도 한산한 편이라 여행하기 좋습니다  안개 사이로 보이는 염소와 말   때문에 서우봉 유채꽃밭은  혼자 여행 하기도 좋은 스폿인데요  혼자 여유롭게 안개 사이에서 여유를 즐기는 분들이  ,1,1
284,여수 선소 유적지 일몰이 이뻤던  혼자여행 ,여수  혼자여행 하기에 매우 좋은 곳으로 찜하고 싶었다  사실 우리는 혼자가 아니었지만 도착해서는  약간은 쓸쓸해도 좋은 여행을 즐기시는 분이라면 여수  혼자여행 으로 이곳을 선택하라고 권하고 싶다  ,1,1
285, 런던  혼자여행   일차   빅토리아 앨버트 박물관  ,어케 이렇게 겹쳤는지 모르겠으나 암튼 유럽여행의 첫 동행이라는 것이 생겼는데 결론부터 말하자면 넘 좋았다 난 이미  혼자 여행 은 앞의  일에서 충분히 한것 같았고  플랫아이언은  년전에 왔었지만 혼밥이  ,1,1
286,평창  여행  여자  혼자  국내 여행  평창 육백마지기 청옥산 전망대,평창 여행 여자 혼자 국내여행 평창 육백마지기 청옥산 전망대 어딘가를 찾아 나선다는 기분은 다양할   시간 달려 찾아보니   혼자 여행 으로 찾아도 될 정도로 생각보다 쉽게 찾을 수 있었어요    평창  ,1,1
287,오사카  혼자여행  기록 간사이 공항에서 우메다역 가는 방법,사람이 항상 많은 곳이라 긴장도 많이 했고 길을 잃어버리기도 했지만 처음은 누구나 헤매니까   즐거웠던 여행이었다  오사카  오사카여행  오사카 혼자여행   혼자여행   라피트  난바역환승  간사이공항  ,1,1
288,할슈타트   오베르트라운  년   자유여행 해외여행 혼자여행 ,생각해보면 동유럽  여행 기간 동안  혼자  자유 여행  하느라 힘들었지만 그만큼 행복했던 적도 손에 꼽을만큼 없었던 것 같다  식사를 마치고 소금광산을 예약한 분이 있어서 마을풍경을 감상하며 소금광산으로  ,1,1
289,제주도  혼자 여행   일차, 혼자 여행 의 장점이 이런 거지 뭐  내가 서귀포에 숙소를 잡은 이유는 바로 맛있는 커피집이 있기  커피 한 잔의 양이 생각보다 적은 편이라 혼자서 두세 잔은 마실 수 있다  게다가 제일 마음에 드는 점은  ,1,1
290,여자  혼자  배낭 여행  서유럽 파리 스위스 이탈리아,스위트유로  월  월  월 배낭여행 일정 특히 혼자 유럽여행하는 분들한테 유럽 세미패키지여행은 좋은 옵션 같아요  유럽  혼자 여행 하면 좀 외로울 수 있는데  또래끼리 만나서 같이 사진도 찍어주고 맛집도 가고  ,1,1
291,제주  혼자 여행 에 액티비티까지  성산일출봉 숙소 플레이스  ,제주여행 혼자의 시간  제주가볼만한곳 찾으시는분들  너무 좋은 시간 액티비티와 함께 하고 아침엔 오름으로 제주도 오름도 정복하고  바다까지 두곳 클리어하고 돌아갑니다   광치기  김녕  제주  혼자 여행  ,1,1
292, 태국 방콕  혼자여행  수완나품공항 흡연실 흡연구역  ,내가 살아내야할 현실이 있어서 여행이 더 좋은 것 아닌가 애써 생각해본다  다음 여행을 기약하며 더 열심히 살아보기로 한다   월의 태국 방콕 파타야  혼자여행  끝  다음 여행은 또 언제가 될까 ,0,1
293,제주 동쪽 오름 백약이오름  혼자여행  오름올라밤 액티비티 추천,제주여행을 누구랑 가세요  저는 주로 혼자 슝 날라갑니다  제주  혼자 여행  해도 정말 좋은 곳이 바로    그리고 제주를 제대로 즐기는  혼자서도 잼있게 놀 수 있는 액티비티를 소개합니다  퐐로미  ,1,1
294,이집트 자유 여행  일주일   여자  혼자 도  시간 준비해서 떠날  ,이집트 여행에서 무엇이 중요하다고 생각하시나요  아무래도 여자  혼자 여행 하는 거다보니 치안이  사막투어 동행분이 동안은 셀프투어 가능하다고 해서 혼자 다녀보려구요  일 룩소르  박   ,1,1
295,오사카 날씨 옷차림  월 여자  혼자 여행  꿀팁정리, 일본오사카여행  오사카가볼만한곳  오사카여행일정  오사카여행코스  오사카 혼자여행   오사카여행  오사카여행지도  오사카자유여행  오사카날씨  오사카옷차림 업체로부터 수수료를 받을 수도 있습니다,1,1
296,      발리  혼자 여행  중 ,있는 동안은 발리에 있는 하루 하루를 즐겨야겠어요  꾸따에서 서핑하기  길리에서 자전거 타기 딱 두가지만 해보고 돌아갈거에요   이것이  혼자  발리  여행 하는  의 계획이에요 ㅋㅋㅋ  또 소식 전할게요 여러분,1,1
297,라스베가스  혼자여행     월도프 아스토리아 호캉스  수영장 ,아침먹기    혼자  천천히 밥먹는 것 아주 좋아  예쁜 버블 장식 밥을 먹고 거리로 나왔는데 피로가  좋은  여행 을 만든다 이렇게 대왕 욕조도 있고  제일 좋았던 점 문을 열고 들어가면 이렇게 가방을 놓는  ,1,1
298,싱가포르 스마트  혼자 여행    해외여행필수어플,유튜브 썸네일 해외 여행   장샘의스마트폰활용 싱가포르 여행을 떠나기 전에 한 일과 인천 국제  리버 크루즈는  혼자 여행 으로 썰렁할 뻔한 여정을 업그레이드해주어 예매하기를 너무 잘했다고  ,1,1
299,여자  혼자 여행    혼자 해외여행 갈만한곳 고민된다면,혼자 해외여행 갈만한곳 정리한 오늘 포스팅은 여기까지    에피의 여행 인플루언서 홈에 놀러오세요   혼자해외여행  여자혼자해외여행  여자 혼자여행   혼자여행   혼자해외여행갈만한곳  여자혼자싱가포르  ,1,1
300,속초  혼자 여행 할 때 머물기 좋은 카페  술집,속초 호텔 테라스에서 본 풍경  혼자  속초  여행 을 하며 자주 갔고  지금도 자주 다니고 있는 공간들을 보여드릴게요  지나가며 문득문득 촬영하고 아무런 보정조차 하지 않은 사진과 함께 소개하겠습니다  ,1,1
301,여자  혼자  제주도 여행 ,ㅎ ㅋㅋㅋㅋㅋㅋㅋㅋㅋ 애플워치 없는  혼자 여행 온 사람  이튿날 두번째 목적지는 애월에 있는  귀욤쓰 혼자 딴길로 들다가 도착한  애월책방이다 여행 전 책 한 권을 챙길까 하다가 근처 책방에서 한 권 사서  ,1,1
302,부산  혼자여행  이용하기 좋은 숙소 광안리 캡슐호텔,저녁시간 난 기차를 타러 가야하구 딸램은 혼자 남아 남은 여행을 즐기기로 했어  야경까지 꼼꼼하게 즐기고 일출까지 캡슐에서 바라볼 수 있었단다  다 컸네 이젠  혼자여행 도 즐기구  부산 가고 싶다 노래를  ,1,1
303,경주  혼자여행   탄   대릉원  사진 찍기 좋은 곳   혼자여행 객  ,뒷편에서도 찍어보고  혼자 왔으니 아쉬운 대로 그림자 사진 찍기 뭔가 동산 느낌도 나고  하늘도  국내여행지  혼자여행 지  내돈내산  사진  봄  여행사진  힐링  대릉원풍경  대릉원사진  데일리  일상  일기  ,1,1
304,제주도 야경스냅 숨스튜디오  혼자여행  추천,준비물   운동화  담요 겉옷 제주도  혼자 여행 으로 일정을 짜다가  혼자 여행 이니 인생 사진을 못 찍겠다  신혼여행 중이라고 해요 ㅋㅋㅋㅋㅋㅋ 혼자 분주히 움직이시면서 척척 준비를 다 하십니다 이날  달이  ,1,1
305, 혼자  가는 바르셀로나  여행   일차   사그라다 파밀리아    ,햇살도 적당히 따사로운 게 오늘 하루 혼자서도 근사한 여행을 할 수 있겠구나 싶었다  얼마 기다리지   바르셀로나  스페인  유럽  바르셀로나여행  바르셀로나 혼자여행   사그라다파밀리아  성가족성당  ,1,1
306,홍대 가볼만한곳 서울  혼자여행  무신사테라스 가는방법  주차, 혼자 여행  함께 여행 각각 장단점이 있지만 혼자이든 여러 명이든 만약 서울 홍대 놀거리 찾으신다면 무신사 테라스는 한번 방문해 볼만한 것 같아요  테라스 밖으로 나가면 뻥 뚫린 뷰를 보실 수 있어서 도심  ,1,1
307, 별자리  혼자 여행 하는 걸 좋아해  랭킹  물병자리는 풍경을  ,혼자 차분히 관광을 즐긴다   위 양자리  여행지에서 기댈 수 있는 것은 자신밖에 없다 라는   혼자여행 의 서바이벌 상황에 불타오른다   위 염소자리  욕심쟁이라서 여행을 한다면 가급적 많은 명소를  ,1,1
308,  봄방학  혼자  토론토  여행   토론토 코믹콘 , 토론토  캐나다여행  코믹콘  오타쿠  캐나다  캐나다여행  토론토여행  혼자여행  이번 봄 방학땐  분명 제일 매운 라면이고 더 맵게 해달라고 했는데 맵기는 커녕 겁나 잘더라구요  혼자 밥 먹는 거라 혼밥  ,1,1
309, 제주 여행  제주  혼자여행 의 모든 것   올레 코스,내일도 열심히 걸어야 하니  오늘도 잘 쉬어줘야 겠습니다     제주  혼자   여행   올레길  코스  우도  카페이아  엘에이쌀국수  해녀박물관  괜찮아게스트하우스  우드스푼  갈치덮밥  세화  지미봉,1,1
310,일본 여자  혼자 여행  숙소 추천   후쿠오카 캡슐호텔 나인  , 년 반 만에 가는 해외 여행   후쿠오카 여행  첫날은  혼자  보내야 해서 가성비 좋은 나인 아워스 캡슐호텔을 다녀왔어요  바쁘신 분들은 맨 아래 꿀팁 남겨놨어요 나인 아워스 나카스카와바타 캡슐호텔     ,1,1
311,키와미야 함바그 하카타   후쿠오카  혼자여행  중 맛집 오픈런 ,진짜 내가 어지간하면 웨이팅 안한다니까  함께 보면 좋은 글 이번 후쿠오카  혼자여행 에서 맛보았던  다른 맛집들  대만족    팬하기를 하시면 락주의 별별 여행기를 다 보실 수 있습니다  ,1,1
312,묵호  혼자   박 일 여행  첫째날,없다 혼자 먹을거라 그냥 닭강정 중으로  꼬꼬눌러서 사장님 부름ㅋㅋㅋㅋ 사장님이  혼자 여행 왔어요  오길 잘했다는 생각하고 잠들었다  묵호  묵호 혼자여행   묵호여행  묵호뚜벅이  묵호 박 일  묵호카페,1,1
313, 혼자  속초 여행  분위기 좋은 이색적인 혼술 맛집  속초 아프리카,이 방을 스쳐간 사람들은 대부분  혼자 여행 을 떠난 사람들 연인과 헤어진사람  시험에 떨어진사람  직장을 잃은사람 등 대부분 위로를 받고 싶어서 혹은 생각을 정리하고싶어서 혼자서 여행을 나선 사람들이였다  ,1,1
314, 혼자여행 을 둔갑한 오사카 일차 쇼핑,빵이랑 라이스 중 선택할 수 있는데 나는 밥을 택했다 여행은 밥심  배터지게 잘먹었습니다 호호 다음  ㅎㅎ 쇼핑만 했는데 너무 힘든하루 내일은 교토 가는데 일정 하나도 안짜놓고 취침했다  오사카  혼자여행 ,0,1
316,국내 제주  혼자 여행  제주도 게스트하우스 추천 서귀포 하랑,제주도 게스트하우스 추천 여긴 차분한 분위기에서 조용히 하룻밤 머물고 갈 여행자에게 알맞아요  국내 여자  혼자 여행  조용히 혼자 머물기 괜찮아요  게스트하우스 건물 주변  대의  가  시간 작동  ,1,1
317,국내당일치기  혼자 여행 으로 알차게 놀다왔던   장소,다들  혼자여행  다녀오게 되면 어떤 느낌이냐고 많이들 물어보시는데  은근 제가 할 수 있는 것들은 저 혼자 짜고 가고싶은곳을 다 갈 수 있어서 다같이 가는 여행보다 더 알차게 다녀오는 경우가 많아서 전  ,1,1
318, 여행   혼자 서도 잘 노는 겨울 부산 여행  첫날  ,관광지마케팅   혼자 여행 하면 하루필름 한장 정돈 남겨줘야지 의도치 않게 푸른톤 맞춰감 거울 뒤로 해변 보이는 거 진짜 낭만의 끝 아니냐구 유일하게 계획하고 온 숙소 호텔  여자 혼자 부산여행 검색하면  ,1,1
319,베트남  여행  호치민 여자  혼자  자유 여행  후기   ,호치민은  년 전쯤 다녀왔어요 비엣젯 오픈데이 간 김에 여행까지 다녀왔거든요 베트남은 오토바이 천국인 거 아시죠 ㅎㅎ 그리고  혼자 여행  가면 그랩 혼자 타기도 조금 그렇고 저는 그랩어플로 오토바이  ,1,1
320, 혼자  부산  여행  추천 실내 관광지 갈만한곳 부산 박물관,혼자 부산 여행 추천 실내 관광지 갈만한곳 부산 박물관 오랜만에   를 타고 당일치기 부산여행을 다녀왔습니다  이번에 부산은 혼자 찾았는데  혼자여행 의 장점은 잠깐 시간이 남았을 때 원하는 곳을 자유롭게  ,1,1
321,호텔스닷컴  월 할인코드 여자  혼자  해외 여행 ,파리만큼 혼자 해외여행 떠나기 좋은 곳도 없을 거 같아요 오늘은 해외여행 계획할 때 가장 신경이 쓰이는 호텔 비용 줄여주는 호텔스닷컴  월 할인코드 그리고 파리  혼자 여행  가서 지내기 좋았던 파리 호텔을  ,0,1
322,서울  혼자여행  망원동 비건 대안부엌풀  두두리두팡,특히  혼자 서  여행 하는 저에게 마음의 안식을 주는 공간이라서 좋았네요  슴슴한 걸 좋아하지 않는다면 프로틴 샌드위치를 추천드립니다  저는 속이 안 좋아서 정말 건강한 한 끼 먹은 기분  그리고 다음으로  ,1,1
323,제주 서쪽 가볼만한곳 여자  혼자여행  제주도 서쪽 코스,계절은 가을을 지나 겨울로 가는 길목이었어요 열씨미  가을 억새 풍경이 보고 싶어 짧게 제주 여행을 다녀왔어요  여자  혼자여행 으로 돌아다녀도 좋을 제주 서쪽 가볼만한곳 위주로 둘러봤는데요  ,1,1
324,후쿠오카 유후인 다자이후 일본  혼자여행  야쿠인  텐진 하카타, 혼자 여행  갈 때는 밤에 안 돌아다니기에  요번 여행 때는 야경사진이 없네요   이치란 본점도 나카스강 근처에 위치해 있어요  예전에는 이치란 본점에서 먹었었는데  대기줄이 길다고 하여 패스   일차  ,1,1
325, 빈  열여섯째날 혼자  유럽  여행  도나우강의 샛강  왕궁  ,것도  혼자 여행 이라 맘껏 ㅎㅎ 도착한 곳은 스위스 정원 벨베데레 궁전과 중앙역 근처에 있는 공원이다 영상으로  가벼운 발걸음  다들 잔디와 한 몸ㅋㅋ 피크닉 온 사람들 다음 여행엔 나도 본격  ,1,1
326,후쿠오카 유후인 일본  혼자여행  킨린호수,유후인 킨린호수 가신다면 사진 많이 찍으세요  남는건 사진밖에 없으니까요   일본여행  자유여행  후쿠오카  유후인  일본  혼자여행   유후인킨린호수  킨린호수,1,1
327, 일본 오사카   혼자 여행    소라니와 온천 이용 후기,여행 갔다온 지 일주일이 지나서 버닝타임이 끝난 느낌  이지만 의지를 가지고 열심히 적어봅니다  제일의 온천으로 강추한당  다들 즐여즐여 연관글 오사카 일정 및 경비  혼자 여행  숙소 캡슐 호텔 추천,1,1
