,title,description,title_label,description_label
492,비 오는 제주 나  혼자 여행  코스   본태박물관   노리매  ,혼자 제주여행하시는 분들은 꼭 한 번 가보시면 좋을 것 같았답니다  본태박물관 운영시간       입장료 성인  원 어린이  원 혼밥 하기 좋았던 소규모식탁 소규모식탁 모정식 만두국   혼자 여행 하면  ,1,1
493, 월 태국  박  일  혼자 여행   일차,기내식도 먹고 편하게 옴 인천 와서 마약 탐지 댕댕이도 만나고 집에 와서 엽떡 먹으며 광광 우럭따 너무 짧은  박  일의  여행  처음으로  혼자  한  여행 이어서 더 기억에 남는다  월에 다시 보자 방콕,1,1
494,강릉  혼자여행  강릉 해변 추천 강문해변,방문하는 여행객들의 발걸음이 이어지고 있는데 이렇게 할머니와 손주의 조합은 정말 가슴 찡한 감동을 주기도한다  이날은 나도 강릉  혼자여행 이었는데 이 분도 마찬가지였던 모양이다  이곳에 혼자 언제 까지  ,1,1
495, 여행 가는꿈  혼자 떠나는꿈해몽  여행 가는꿈해몽  해외 여행 꿈해몽, 혼자 여행 가는꿈을 꿔보신적 있으신가요  어디론가 가는데 너무 기분이 좋고 상쾌한거에요  어떤의미가 있는지 알아볼게요  여행 가려고 준비하는꿈해몽은 어떻게 해석이되나요  이꿈은 길몽으로 해석됩니다  ,1,1
496,제주 혼자여행  제주시카페 썸스테이,대학교  학년 때 제주 혼자여행 을 왔던 적이 있다  공항에서부터 눈앞에 보이던 사람  자기보다 더 커  제주 혼자여행 에서의 잔이라기보다는 제주사람이 거실 의자에 앉아 아침햇살을 맞으며 바다를  ,1,1
497, 남해   월 겨울  혼자 서 국내  여행 ,있어서  혼자  피맥 하면서 놀있다  밤에 장기 투숙하시는 분이 오셔서 잠시 수다 타임을 갖긴 했었다 ㅎㅎ 남해 바래길  남파랑길  암튼 걷기  여행  하시는 분들이 자주 온다고 하셨다  방이나 침구는 깨끗했다  ,1,1
498,성 이시돌 목장   여자  혼자 여행 하기 좋은 곳,얼마 전 제주도 성 이시돌 목장을 여행할 기회가 있었어요  이틀을 푹 있고 나니 여자  혼자 여행 하기 좋은 곳이라는 생각이 들더라고요  오늘은 그 이야기를 하려고 해요  성 이시돌 피정의 집  목장이라고 해야  ,1,1
499,후쿠오카  혼자여행     박 일 여행 끝,술한병과 명란 하나 사서 명란은 엄빠집에 드리고 왔다  이렇게 후쿠오카  혼자여행  여행기 끝    팬하기를 하시면 락주의 별별 여행기를 다 보실 수 있습니다  ,1,1
500,여자  혼자  제주  여행      월령포구  선인장군락지  ,여행을 오면 힙하고 핫한 곳 위주로 방문을 하기 마련이기에 올 일이 없었을 듯 하다   혼자 여행 을 하니  한  도 빠짐 없이 행복했다  즐거웠고  상쾌했고  시원했다   여자혼자제주여행  탄 끗   아직 멀어똬 ,1,1
501,후쿠오카  혼자여행  숙소리뷰        ,장점  가격 저렴 주방 이용가능 조용한 주거지역을 원한다면 이곳도 나쁘지않다 혼자서 이용하기도 아주 넓고 여유로웠다  후쿠오카  후쿠오카여행  후쿠오카 혼자여행   혼자여행   숙소  아파트  ,1,1
502, 혼자여행  스리랑카 콜롬보   정직하게 삽시다 우리,나  혼자  걷고 있다니 후회막심하던 그때 갑자기  번이 달려오길래 달리는 버스 세워서 겨우 탔다  캄보디아  여행 처럼 첫인상을 망쳐서 기분이 안 좋을 뻔했지만 이후 만난 좋은 사람들 덕에 다행히  ,1,1
503,국내 뚜벅이 여자 혼자여행  하며 한적해서 좋았던 갈만한 곳,뚜벅이 여행 강릉 여자 혼자 여행 하며 먼저 만났어요  이 곳에서 먼저 만난 벚꽃길이 너무 예뻐서 그냥  힘내서 다시 국내 여자혼자 뚜벅이 여행 시작 강릉 여행 갈만한곳 선교장도 곧 보여드릴께요  ,1,1
504,함께하는  여행 과  혼자  하는  여행 ,혼자 속초와 제주도를 다녀온 적이 있어서 그런지  혼자  떠나는 것이 진정한 여행이라는 확신이 들었다   혼자 여행 을 떠나면 신경 쓸 것이 없다  내가 가고 싶은 곳에 가고 마음에 드는 공간에서 내가 머물고  ,1,1
505,후쿠오카 유후인 일본  혼자여행  봄바키친 치킨난반정식,예전 여행때는 언니들이랑 셋이서 갔던 봄바키친 골고루 시켜 먹었었는데  요번에는  혼자여행 이라  가장 인기있는 메뉴 치킨난반정식 시키려고요  포장도 가능하니  포장해서 숙소에서 드셔도 좋을 거 같아요  ,1,1
506, 혼자 여행 하기 좋은 곳 성북동 최순우옛집,오늘은 혼자 멍하니 앉아서 생각에도 잠기고 조금은 어색한 셀카놀이도 하고  유목민은 평소 셀카를 찍지 않아요  그전엔 보이지 않았던 것들이 눈에 들어오네요  이젠 다음 여행지로 향해봅니다   나 혼자여행  ,1,1
507, 여행  기록 국내 제주도   월 박  일 탄       혼자 ,이번 여행은 친구들과 처음으로 함께 제주도 여행갔다는 것과 혼자 제주도 여행한 것에 큰 의의가 있었다  친구들과의 여행도 너무 좋은 추억이 되었고  혼자 여행 도 새로운 사람도 만나고 예전에 제주도  ,1,1
508,성당  국회의사당  겔레르트언덕   해외여행  자유여행   혼자여행 ,신청하지 않았다면 이 곳까지는 혼자 오진 못하였을 것 같다  이런 야심한 시간까지 인적이 드믄 언덕을 혼자 방문하면 무슨일이 일어날 수도 있기 때문에   혼자 여행 가는 분들은 일일 야경 투어 정도는 추천한다 ,1,1
509,후쿠오카 유후인 일본  혼자여행  돈키호테,후쿠오카 유후인 일본  혼자여행  돈키호테 텐진에서 걸어서 간 돈키호테 나카스점  층에 위치해 있는  비토 젤라또 먹어보고 싶었지만 요번 여행 때는 추워서 패스하게 되네요   층으로 올라가면 바로 있는  ,1,1
511,유럽 세미패키지 여자 혼자  해외 여행  추천 코스,커플여행을 다니기 전에도 여자혼자해외여행 가는 것을 즐겼는데 일본  홍콩  마카오 같은 가까운 곳은  낭만과 여유가 넘치는 헝가리 부다페스트 여자 혼자여행 으로 괜찮은 동유럽여행지 두번째는 헝가리  ,1,1
512,강릉 여행  박 일   혼자여행  숙소 추천 카페 닭강정먹즤마요 ,나는 혼 여행 과 맞지 않는 사람인 것을 이번 기회에 느꼈다  다만 숙소  혼자  쓰는 것은 너무 햅삐  다음에도 동행정도만 구해서 오는 것은 좋을 듯하다    명절에는  그것도 당일엔  여행 가는게 아니다 가고  ,1,1
514, 혼자  하는 유럽  여행  스페인   그라나다   알함브라 궁전  ,  혼자 하는 유럽 여행   스페인   그라나다   스페인 여행  그라나다 여행  알함브라 궁전  그라나다  예쁘더라구요  혼자 여행 이라면 동행을 구해서 서로 사진 찍어주며 같이 다녀도 좋을 것 같아요 기왕 가는  ,1,1
515, 박 일 여자 혼자  싱가포르 여행    일차 점보시푸드 쇼핑  ,  발리가기 전 싱가포르  박  일  여행   일차  야쿤카야토스트    맥스웰센터  맥도날드  역시  혼자 라서  더 지나치게 된다 ㅎㅎ 다 먹고 놓는 곳 나와서 그냥 좀 걸었다 한식당도 막  ,0,1
516, 혼자여행  중 남편근황   안식년 킹받음,가지리라  혼자여행 을 선언했던 남편은 이번만큼은 굳이 안지켜도 되는 자신의 말에 책임을 지는  아빠와의 여행으로 같이 보낼 예정이었던 큰 아들램도 학교를 다닐 수 있게 되면서 세 명 다 비엔나에 남게  ,1,1
517,오사카  혼자여행  난바 야경 쇼핑타임,열쩡적으로 오사카 교토여행 포스팅 신명나게 달리는중 이랴 ㅋㅋㅋㅋ 죄송  저번 친구와  나만 혼자여쒀  그렇지만 당당하게 찍는다 그것이 오사카  혼자여행 의 묘미 아니것소 도톤보리는 핫하다  ,0,1
518, 월   월 유럽 여행  후기  여자 혼자  유럽 여행  어렵지 않아요 ,  여자혼자 유럽여행도 이렇게 안전하고 알차게 다녀올 수 있다고 여러분들에게도 꼭 이야기해 드리고 싶었어요  돈으로도 살 수 없는 게 시간과 추억이잖아요  여러분들도 꼭 한 번쯤은  혼자여행  가보시면  ,1,1
519,몽골  여행 을 패키지로  혼자 계획중이야,안녕  솔뱅이야   솔뱅  솔뱅의내행됐  여행계획  혼자여행 계획  몽골여행패키지  나랑별보러가지않을래 어제 친구들을 만나서 얘기하다가 몽골여행을 혼자서 패키지로 다녀와야겠다고 말했거든  와  진짜  ,1,1
520,동해 묵호 서점 국내 여자  혼자여행  책방 잔잔하게,국내여자 혼자여행  중 만난 여행책방 잔잔하게 글 사진 대문자알 여행책방 잔잔하게 주소 강원도 동해시 발한로   영업시간    매주화요일휴무 우선 이 서점은 간판이 없다  그래서 그냥 지나쳤나보다  ,1,1
521, 인생 첫   혼자  부산  여행 ,올해 버킷리스트 중 하나인  혼자 여행 을 하기 위해 고민하던 중 뚜벅이들도 여행 가능한 부산으로  로또야 제발 당첨되어줘  혼자 첫 여행이라 너무 뜻깊다  나중에 해동용궁사까지 보러 꼭 다시 갈 것이다 ,1,1
522, 혼자  태국  여행  님만해민 카페    ,혼자 태국 여행 님만해민 카페     글 사진 하은정원 안녕하세요   나 라는 정원을 가꾸어가는 이야기  여행블로거 하은정원입니다  오늘은 태국  혼자 여행  중에 다녀온 카페를  ,1,1
523,속초 혼자여행  중앙시장 구경,속초중앙시장 정식이름은 속초관광수산시장 입니다  속초여행 혼자가면  혼자여행  맞죠 ㅎㅎ 평일 속초 혼자여행  좋아요  감자전집 여름에는 안 하시는데  아직 하고 계시네요  고성 살 때는 버스타고 와서 조  ,1,1
524,여자  혼자 여행  하기 좋은 제주 애월 오션뷰 감성 숙소   ,안녕하세요  여행 블로거 초이에요 여름 되니까 급 제주 가고 싶어서  혼자  제주도  여행  다녀왔어요 유튜브 보다가 이 애월 바다뷰 숙소 보고 바로 숙소부터 결제했는데요 제가 가는 날에 딱  자리 남아서 바로  ,1,1
525,서울 가볼만한곳 동대문 디자인플라자    혼자여행  서울 실내  ,서울  혼자여행 으로 다녀왔습니다  전시회를 구경하기도 좋고  야경 사진 찍기도 좋은데요  주변에 유명한 시장도 있어 재미나게 시간을 보냈습니다  여행 일자    년  월  일 동대문 디자인 플라자 서울 중구  ,1,1
526,체코 프라하 여행 체스키크롬로프 투어ㅣ동유럽 여자  혼자 여행  ,저는  여행  당시에  혼자  유럽 여행 을 다녀왔어요  파리인으로 하고 부다페스트 아웃으로 하는 일정이었어요  프랑스 파리에서  여행 을 하고 다시 샤를드골 공항에서 항공편을 이용해서 체코 프라하로  ,1,1
527, 구례 가볼만한곳   국내  여행 지 추천  여자  혼자   박 일  여행  ,혼자온 사람은 저 하나였지만 사람들 구경하는 재미있었는데요  커플들이 많았고 친구랑 같이 온   혼자여행   구례여행  여자 혼자여행   국내여행  구례가볼만한곳  구례여행지  구례여행추천  ,1,1
528,후쿠오카 유후인 일본  혼자여행  스타벅스 다자이후 오모테산도점,제 양을 알기에 패스했어요  이럴 땐  혼자 여행 하는게 참 슬퍼요  줄서서 주문하고 옆에서   후쿠오카  다자이후  일본여행  스타벅스  스타벅스다자이후  스타벅스다자이후오모테산도점  ,1,1
529,파리 여행  후기      혼자 서 파리 여행   박 일 일정 및 관광지 팁  ,여자 혼자여행  뚜벅이 여행 전 일정  여행 당시 타임라인을 최대한 자세하게 적어봄 좀  관련글 혼자서 파리여행  일차 파리여행 준비     교통권 정리  대중교통 이용법  샤를드골 공항에서 시내가는 법  ,1,1
530,집  파리근교 투어   파리 여행   일차  여자 혼자  유럽 여행 ,파리근교여행  지베르니 투어 모네의 집  파리여행  여자혼자유럽여행 파리  혼자 여행   일차 일정 파리 현지 가이드 투어  당일치기    지베르니     오베르 쉬르 우아즈     베르사유  ,1,1
531,국내 여자  혼자 여행  제주도에서 걸으면서 성공하기,그리고 몰랐던곳 처음 가봤던 낯선곳에서 보내는 시간들이 행복한 것이지요 그래서 국내 여행 여자 혼자 하는 이 여행이 즐겁습니다  대두분은 처음 이런 여행을 해 보신다고 하시더군요 국내 여자  혼자 여행 을  ,1,1
533,아빠  난 잘 있오  아빠 혼자여행 가다  제주의 월 ,결혼하고 혼자 처음으로 여행간 이든아빠  처음이니까  아쉬운 점들은 다음에 보안하자    년에 두번은 이렇게  혼자 여행 보내주기로 했다  비수기에  얼마든지  다녀본 사람이 알제  많이 다녀보소 이든이 크면  ,1,1
534, 남해   월 겨울  혼자 서 국내  여행 ,클스마스에 혼자 마셔야지 ㅎㅎㅎㅎㅎㅎ 같이 산 블랙 올리브와 함께  이렇게 여행  일차도 맥주와 함께  뜨거운 밤 난방을 조절해도 바닥이 너무 뜨거웠다 을 보냈다   여자 혼자여행   국내여행  월여행  ,1,1
535,알차게 바람쐬는 군산  혼자여행 ,여행지들이 비교적 가까운 곳에 모여있으며 여행지들 대부분이 가볍게 둘러볼 수 있어서 혼자서도 여행할 수 있는 곳인데요  제가 지금부터 군산  혼자여행 으로도 방문이 가능한 여행지  곳을 알려드리겠습니다  ,1,1
536,나  혼자  강릉 여행   여자 혼자 강릉 여행 ,나 혼자 정말 잘 노는구나  허허허  굿나잇  굿모닝   혼자 여행 가니 좋은 점  에너지 소비가 덜하니 아침에 일찍 일어남  가족여행을 가도 나만 일출 풍경은 매번  ,1,1
537,나  혼자  대만 여행     만원에 대만행 비행기표 예매, 일이라는 긴 기간이지만 지인들과는 일정 맞추기는 어려워  혼자 여행 을 떠나기로 한다  사실 최근  번째 혼자 해외 여행 나 진짜 가는거야  여행지로 대만을고르기까지 정말 오랜 시간이 걸렸다  ,1,1
538,후쿠오카 유후인 일본  혼자여행  링고 애플파이,후쿠오카 유후인 일본  혼자여행  링고 애플파이 링고 애플파이는  년전 후쿠오카여행 때 우연히 알게되었는데 그때보다 지금 더 유명해진 링고 애플파이 텐진 지하상가  번출입구 쪽에 위치해 있어요  빨간  ,1,1
539,주간일기  제주도  박  일  혼자여행 ,제주도여행  주간일기  제주여행  혼자여행  일이 생겨 급 제주행  목요일에 계획하고 토요일에 떠난 제주도여행이에요  선택할 수 있는 비행기 시간이 많지않고 가격은 비싸고 가족들은 감기로 고생중이라  ,1,1
541,대만  혼자여행  하며 가본 타이베이 디저트 맛집   푸딩 같던  ,대만  혼자 여행 하며 다녀온 타이베이 이색 맛집     우잉천 두화점    푸딩 같은 연두부  여행 셋째 날이어서 여행 내내 많이 걸어서인지 이날 이십분의 도보는 저에게도 조금 힘들게  ,1,1
543,치앙마이에 그가 왔다   혼자 여행  끝  둘이 하는 여행 시작,ㅎㅎ  둘이 만나서 내 빠이  여행  얘기 들려주면서 ㅋㅋㅋㅋ 깔깔대면서 어찌나 웃었던지 내 치앙마이  여행  반은 앤님 만나서 행복햇던거  헷 앤님이랑 해피타임 보내고 숙소로 들어갔다가 문득 아  나 김과자  ,1,1
545,아이들이 학원 가방을 꾸릴 때  아들  혼자 여행  가방을 꾸리다,그러면  혼자  조용히 중얼거렸어요  그래           그 언니의 방  중에서 지금  그 언니의 방 에서는  육아 를 주제로 다음과 같은 글들을 연재하고 있습니다   엄마의  년 에서 지면 상 상세히 풀지  ,1,1
546,여자 혼자 해외 여행  홍콩 자유 여행  호텔추천  명품쇼핑몰 안  ,여자혼자해외여행을 다니며 해외호텔을 소개하는 여행 인플루언서 콩미입니다 한국인들이 사랑하는  여자 혼자여행 으로 홍콩자유여행시 추천드리는 홍콩명품쇼핑몰 과 같은 건물 안에 있어 위치와 서비스  ,1,1
547, 혼자여행  통영  박 일 여행  일차   통영 대교  수메르 카페  , 나 혼자여행   혼자여행   혼자통영  통영  통영여행  통영대교  수메르카페  통영카페  통영대교카페  통영디저트카페  통영뷰맛집  국내여행  찐후기  솔직후기  솔직담백한  내돈내고다녀온여행  여행후기 찐  ,1,1
548, 혼자 여행  꼭 가고 말테야 ,하지만 이렇게 씩씩한 저도 아이를 낳고 남편이 있고  혼자  사업을 운영하다보니  혼자  훌쩍  여행 을 떠나본지가 언제인지  모든것을 멈추고  여행 을 간다는것이 쉽지 않은 일이 되어버렸습니다 ㅠ ㅠ 커다란  ,1,1
549,지리산  혼자여행 일차,엄마표 된장  저녁 바베큐 하려고했는데  밤이 늦어서  혼자 는 무서워서 급 된장찌개모드로 ㅎㅎ 뚜벅이라  박동안 냉장고 털어먹기 합니다ㅋ 제인 에어 이번  여행 목표   하루 한권이상 책 읽기  오늘 그동안  ,1,1
550,강릉 걷기 좋은 길 월화거리 여자  혼자  국내 뚜벅이 힐링 여행 ,강릉 여행 코스로 걷는걸 추천드려요   월국내여행지추천  국내여행  강릉여행  걷기좋은길  월화거리  국내뚜벅이여행  여자 혼자여행   혼자여자여행  국내힐링여행,1,1
551,갑자기  혼자  떠난 안동  여행  두번째,식당은  일직식당   혼자  하는  여행 이고  간고등어는  인기준으로 판매하기 때문에 못 먹을 줄 알았는데 이 곳은  인분도 판매하고 있었다  이렇게 감사할 수가  덕분에 간고등어를 내 양만큼 잘 먹을 수 있었다  ,1,1
552,부산  여행   혼자  놀만한곳 부산역 놀거리 먹거리 전망대 야경,배부르게 먹으며 창 밖 부산대교 뷰를 즐기고 있으니 혼자 부산 여행으로도 만족스럽다  식당가에 다양한 메뉴의 음식점과 카페가 기다려 개인 취향에 맞는 것으로 선택할 수 있다  부산  혼자 여행  숙소는  ,1,1
553,강릉 평일 뚜벅이  혼자 여행     일차 ,나도 타고싶었음 ㅠ 아무래도 혼자라서 타지는 못했지만  안목해변은 경포해변보다 더 짙은  정말 오랜만에 또  혼자 여행 을 다녀왔다   혼자여행 은  년 에콰도르 다녀온 이후 처음이었다  또 사진을 많이  ,1,1
554, 서울 혼자놀기  혼자여행  안국역 근처 창덕궁 카페 홍시궁, 혼자여행  다녀온 이야기를 풀어볼까 해요  단풍이 예쁜 창덕궁을 감상하려고 급하게 다녀온 서울여행  서울  혼자여행  코스 이날 저의 서울 혼자놀기  혼자여행 코스는 오전  시에 예약한 창덕궁 후원관람으로  ,1,1
555, 여행  두브로브니크 스플리트  혼자  떠나도 좋은 동유럽  여행   ,번째로 혼자 떠났던 유럽여행이었는데 여행지에서 좋은 사람들을 정말 많이 만나서 더더 행복했던  언젠가  에 나온 뒤로 엄청 유명해진 크로아티아 한국인 관광객들도 정말 많아서  혼자 여행 해도 전혀 외롭지  ,1,1
556,전라남도 여행 벌교 가볼만한곳 보성여관 국내  혼자여행 ,국내  혼자 여행 으로 이번에 보성을 여행하면서 잠시 시간이 남아 벌교 가볼만한곳 중 한 곳인 보성여관을 방문해 보게 되었습니다  벌교역을 오가는 기차는 평일 왕복  회  주말에는 왕복  회뿐이어서 기차  ,1,1
557,  어서 와   혼자 여행 은 처음이지  김남금,거창한 여행서가 아니라 저자가 직접 경험하고 느꼈던 혼자 떠나는 여행에 필요한 여러 가지를 가볍게 전합니다  특히 눈에 띄는 것은  혼자 여행 을 떠나는 것에 대한 준비를 하면서 어떤 마음을 가져야 하는가에  ,1,1
558,오사카  혼자여행  유니버셜스튜디오재팬 디저트 맛집   ,오사카  혼자여행  유니버셜스튜디오재팬 디저트 맛집     글 사진 하은정원 안녕하세요   나  혼자 간 여행도 같이 간 여행도 장단점이 있기에 잘 즐겼다고 말씀드렸어요  그 와중에 저에게 큰  ,1,1
559, 혼자여행 을 둔갑한 오사카 일차 다시 오사카로,짜란 오늘의 편의점 호로요이 종류별로 먹어서 아주 좋았다 저건 뽕따맛 달달하고 맛있었음 녹아서 그랬나 피노는 약간  내취향 아니었다 오늘도 라이브 후기쓰다 기절  범프오브치킨  도쿠시마  오사카  혼자여행 ,1,1
560,여자  혼자  해외 여행  하기 좋은 휴양지  괌 사이판,그렇게 혼자 사는 사람  혼자 밥을 먹는 사람   혼자 여행 을 다니는 사람이 많아지며 어느새 자연스러운 일이 되고 만다  그중에서도 혼자 하는 여행을 일컫는  혼행 의 증가율이 높아졌다  한국관광공사가  ,0,1
561,  나의  혼자  뉴욕  여행    첫 날은 타임스퀘어,더 시간이 지나가기 전에 감정의 기록도 하려고 한다 ㅋ  년  월 나는 뉴욕에  혼자 여행 을 갔었다   뉴욕여행  여자혼자뉴욕여행  여년전뉴욕여행  뉴욕아시아나항공왕복가격  뉴욕플러싱  뉴욕타임스퀘어  ,1,1
562, 혼자여행 은 처음인디  제주도여행  ,믿으시겄나요  여행  내내 날이 흐리거나 비가 와서 잼나는 활동을 많이 하진 못했지만  그냥 잔잔하게 놀다왔슴니더   첫째날  혼자  지하철 타고 김포공항까지  혼자  탑승수속까지  혼자  비행기 찐탑승까지  ,1,1
563, 대만  타이베이여행 오리진 스페이스 숙박 후기 혼자여행  시  ,오리진 스페이스   여자  혼자  하는 대만 여행 이라 이것저것 자료를 정 말 많이 찾았는데  여행  당시가  월 말이라 숙소가 성수기 적용때라서 비쌌다  어차피 낮에는 다니기 바쁘니까  가성비 좋은  ,1,1
564,희망과 염원을 간직한 척주동해비   삼척 혼자여행  삼척역사여행 ,ㅋㅋ 오늘은 안냥냥주부 삼척 혼자여행 중 삼척항 근처 척주동해비및 대한평수토찬비의 역사지에 갔다온  강원도 관찰사의 선정비를 모아 육항산 아래에 세워두었다 합니다  행복한 삼척역사여행되세요  안냥냥,1,1
565,제주  혼자여행  뚜벅이로  박  일 일정 공유,여행의 마지막고  라운지  즐거웠던 제주여행 일정이었습니다   제주여행  제주바다  제주맛집  혼자여행   제주 혼자여행   오설록  아베베베이커리  빵끋  라운지,1,1
566, 혼자  여수  여행  전망대 여수 스카이타워 볼거리 사진찍기 좋은곳,혼자 여수 여행 여수스카이타워 볼거리 사진찍기 좋은곳 혼자 여수를 여행한다면 신경 쓸 부분이  여수  혼자 여행  삼아 찾아서 여수 시내 모습을 구경하기 좋은 여수 전망대  여수 스카이타워  기차역과  ,1,1
567,두부언니의 나 혼자  경주  여행      박 일 월 일  ,어느날 대체공휴일도 꼈는데 놀러가고 싶다 생각하던날 급  혼자 여행 가고 싶어서 숙소부터 예약  거의 즉흥으로 여행 시작했어요 두부언니의 나혼자 경주 간다 코로나이후 여행을 많이 못가서 그런지 성향이  ,1,1
568,여자 혼자 여행 하면 안되는 위험한 해외 여행지, 혼자 여행  가서 혼자서 밥도 먹고 커피도 마시고 여유롭게 혼자 술도 마시는 여유로운 여행을 상상하고는 하는 데요   혼자 여행 을 하다 보면 무엇보다도 다른 사람과 일정  식사메뉴 등 의견 충돌 없이 혼자서  ,0,1
569,파리현지 가이드투어 파리 여행   일차  여자 혼자  유럽 여행 ,파리현지 가이드투어  노르망디 옹플뢰르  파리여행  여자혼자유럽여행  몽생미셸 파리  혼자 여행   일차 일정 파리 현지 가이드 투어  당일치기    옹플뢰르   몽생미셸 파리 여행을 할 때 근교 여행 또는 현지  ,1,1
570, 슬로베니아  여자  혼자 여행 하기 좋은 유럽편  여행  ,그렇게 대부분 다녀본 유럽의 도시  국가 중 여자 혼자서도 여행하기에 좋은 도시를 꼽으라면 저는  여자  혼자 여행 하기에도 좋은 나라라는 생각이 들어요  슬로베니아의 아름다운 도시들을 소개하자면  ,1,1
571, 혼자여행 을 둔갑한 오사카 일차 교토 당일치기,저거 저  클리어 레드 걍 클리어 색상임   두어번 덧발랐다 구냥 핑크색  오랜만에 곧 만나는 동기모임 소소한 선물 챙겨봅니다 정리는  내일 하겠어  오사카  교토  혼자여행 ,1,1
